game_id,white_player,black_player,white_elo,black_elo,game_started_at,game_ended_at,moves,winner,status,eco,name_of_opening,game_duration,num_of_moves
M0SseAhX,ohsusanna,dimke1997,2319,2395,2017-10-18 17:36:06.922000+00:00,2017-10-18 17:42:18.628000+00:00,e4 c6 d4 d5 exd5 cxd5 c4 Nf6 Nc3 Nc6 Nf3 Be6 c5 Ne4 Bb5 g6 O-O Bg7 Re1 Nxc3 bxc3 O-O Bg5 Na5 Bh4 b6 c6 Rc8 Qa4 a6 Bxa6 Rxc6 Rac1 Qc7 Bxe7 Qxe7 c4 Qd8 c5 bxc5 dxc5 Qc7 Bb5 Rxc5 Rxc5 Qxc5 Qxa5 Bc3 Rc1 Qxf2+ Kxf2 Bxa5 Nd4 Bb6 Ke3 Rc8 Rxc8+ Bxc8 Kd3 Kf8 a4 Ke7 Nb3 Kd6 a5 Ba7 Be8 f6 Bf7 Bf5+ Kc3 Ke5 Kb4 Bd7 Nc5 Bxc5+ Kxc5 d4 a6 Bc8 a7 Bb7 Be8 d3 Bc6 d2 Bxb7 d1=Q a8=Q Qd6+ Kc4 Qd4+ Kb3 Qb6+ Ka4 Qd4+ Kb5 Qd3+ Kc6 Qd6+ Kb5 Qd3+ Kb6 Qd6+ Ka7 Qc5+ Kb8 Qd6+ Kc8 Qc5+ Bc6 Qf8+ Kb7 Qe7+ Kb6 Qb4+ Kc7 Qe7+ Bd7 Qb4 Qf3 Qc5+ Kd8 Qf8+ Kc7 Qd6+ Kc8 Qf8+ Kb7,white,outoftime,B13,"Caro-Kann Defense: Panov Attack, Modern Defense",0 days 00:06:11.706000,64
ILih0pa0,emcel,dimke1997,2404,2406,2017-10-18 15:31:01.292000+00:00,2017-10-18 15:32:47.265000+00:00,e4 c6 Nc3 d5 d3 dxe4 Nxe4 Nd7 Nf3 Ndf6 Bd2 Bg4 Be2 Nxe4 dxe4 Bxf3 Bxf3 e5 O-O Nf6 Bc3 Bd6 Qd2 Qe7 Rad1 O-O-O Qg5 h6 Qf5+ Kb8 Rxd6 g6,white,resign,B10,Caro-Kann Defense,0 days 00:01:45.973000,16
JN7CltWG,dimke1997,zugzwang137,2397,2338,2017-10-18 15:23:32.732000+00:00,2017-10-18 15:28:22.672000+00:00,d4 d5 c4 c6 Nc3 Nf6 e3 Bf5 cxd5 cxd5 Qb3 Nc6 Qxb7 Bd7 Qb3 Rb8 Qd1 e5 Nf3 Bd6 Be2 O-O O-O e4 Nd2 Qc7 f4 exf3 Nxf3 Bg4 g3 Bxg3 hxg3 Qxg3+ Kh1 Nh5 Nh2 f5 Bd2 Qh3 Bxg4 Ng3+ Kg1 fxg4 Rxf8+ Rxf8 Qxg4 Qxg4 Nxg4 h5 Nf2 Ne7 Kg2 h4 e4 dxe4 Ncxe4 Nef5 Nxg3 hxg3 Ng4 Nxd4 Kxg3 Rf3+ Kg2 Rd3 Bc3 Nf5 Ne5 Re3 Re1 Rg3+ Kf2 Rh3 Rg1 Kh7 Rg5 Nd6 Rg4 Rh2+ Kf3 Rh3+ Rg3 Rh2 Rxg7+ Kh6 Ng4+ Kh5 Rh7+ Kg5,white,resign,D10,Slav Defense,0 days 00:04:49.940000,45
oXvosqLN,TheMedarman,dimke1997,2340,2388,2017-10-17 21:18:28.822000+00:00,2017-10-17 21:24:33.098000+00:00,e4 c6 Nf3 d5 Nc3 Bg4 Be2 Nf6 e5 Nfd7 d4 e6 O-O c5 Nb5 Nc6 Bg5 f6 exf6 Nxf6 dxc5 Bxc5 c4 d4 Bxf6 gxf6 Nfxd4 Bxe2 Nxe2 Qxd1 Rfxd1 Ke7 a3 a5 Rd2 Rad8 Rad1 Rxd2 Rxd2 Ne5 b3 Ng4 Ng3 Rd8 Rxd8 Bxf2+ Kf1 Kxd8 Ne4 Bb6 c5 Bc7 h3 Ne3+ Kf2 Nd5 Nbc3 Nxc3 Nxc3 Kd7 b4 axb4 axb4 Kc6 Ke3 b6 cxb6 Bxb6+ Kd3 f5 Kc4 e5 b5+ Kd6 Nd5 Bg1 Nf6 h6 Ng8 Be3 Nf6 Bg5 Nd5 Bd8 g4 fxg4 hxg4 Ba5 Nc3 Bb6 Ne4+ Ke6 Nc5+ Kd6 Ne4+ Ke6 Nc5+ Kf6 Ne4+ Kg6 Nc5 Kg5 Nd7 Bc7 Kd5 Kxg4 Nxe5+ Bxe5 Kxe5 h5 b6 h4,black,outoftime,B11,"Caro-Kann Defense: Two Knights Attack, Mindeno Variation",0 days 00:06:04.276000,56
uVINhmmf,pakarma,dimke1997,2342,2379,2017-10-17 21:12:18.019000+00:00,2017-10-17 21:15:48.095000+00:00,e4 c6 d4 d5 f3 e6 Nc3 Nf6 Bg5 Be7 e5 Nfd7 Bxe7 Qxe7 f4 a6 Nf3 c5 dxc5 Nxc5 Bd3 Nc6 O-O f6 exf6 Qxf6 g3 O-O Qe2 b5 Rae1 Bd7 Ne5 Rae8 Nxc6 Bxc6 Qe5 Qxe5 Rxe5 Nd7 Ree1 e5 fxe5 Rxf1+ Bxf1 Nxe5 Bg2 Nf3+ Bxf3 Rxe1+ Kf2 Rc1 Nxd5 Rxc2+ Ke3 Kf8 Nb4 Rxb2 Nxc6 Rxa2 h4 a5 Bd5 Ra3+ Kf4 b4 Nd4 a4 Ne6+ Ke7 Nxg7 b3 Nf5+ Kf8 Be4 b2 Nd4 Ra1 Ne6+ Ke7 Nc5 b1=Q Bxb1 Rxb1 Kg5 a3 Kh6 a2 Kxh7 a1=Q Ne4 Qe5 Ng5 Qf5+ Kh6 Rb6+ Kh5 Kf6 g4 Qg6#,black,mate,B12,Caro-Kann Defense: Maróczy Variation,0 days 00:03:30.076000,50
6IDhpbTh,dimke1997,pakarma,2380,2341,2017-10-17 21:07:11.102000+00:00,2017-10-17 21:12:16.315000+00:00,d4 Nf6 Nf3 d6 c4 Nbd7 g3 e5 Nc3 Be7 Bg2 O-O O-O c6 Qc2 Re8 Rd1 Qc7 h3 Nf8 Be3 Ng6 Rac1 Bf8 dxe5 dxe5 Ng5 Bd7 c5 Rad8 Nge4 Nxe4 Nxe4 Bf5 Qa4 Bxe4 Bxe4 a6 b4 Rxd1+ Rxd1 Rd8 Qc2 Be7 h4 Nf8 Bf5 g6 Bh3 Rxd1+ Qxd1 Ne6 Bxe6 fxe6 Qd3 Qd8 Qxd8+ Bxd8 Kg2 e4 Bd4 Bc7 g4 Kf7 h5 gxh5 gxh5 Bf4 e3 Bc7 Kh3 a5 a3 a4 Kg4 e5 Bb2 Kf6 Bc3 h6 Bb2 Ke6 Bc3 b6 cxb6 Bxb6 Bb2 c5 bxc5 Bxc5 f3 exf3 Kxf3 Kf5 e4+ Kg5 Bxe5 Bxa3 Bc3 Kxh5 e5 Kg6 Ke4 Bc1 Bb4 a3 Bxa3 Bxa3 Kf3 Bb2 Kg2 Bxe5 Kh1 Kf5 Kg1 Kg4 Kh1 Kh3 Kg1 Bh2+ Kh1 h5,draw,stalemate,A46,Indian Defense: Wade-Tartakower Defense,0 days 00:05:05.213000,61
xC8cOIqB,Fourdiesel,dimke1997,2331,2392,2017-10-17 18:39:37.892000+00:00,2017-10-17 18:45:12.406000+00:00,d4 Nf6 Nf3 g6 Nc3 Bg7 e4 d6 Bd3 O-O Be3 Bg4 h3 Bxf3 Qxf3 Nc6 O-O-O Nd7 Ne2 e5 d5 Nd4 Nxd4 exd4 Bd2 c5 Qg3 Nb6 Bf4 c4 Be2 c3 Bxd6 Re8 b3 Rxe4 Bf3 Re8 Rhe1 Rxe1 Rxe1 d3 cxd3 a5 Qf4 a4 Re7 f5 Rxg7+ Kxg7 Be5+ Kg8 b4 Rc8 Bd4 Qe7 Qe5 Qxe5 Bxe5 Kf7 Kc2 Rd8 d6 Ke6 Bd4 Rxd6 Bc5 Nc8 Bxb7 Rd7 Bxc8,white,resign,B08,Pirc Defense: Classical Variation,0 days 00:05:34.514000,35
iGMtHAbr,dimke1997,Firehand,2384,2318,2017-10-17 18:32:31.483000+00:00,2017-10-17 18:38:13.830000+00:00,d4 Nf6 Nf3 g6 c4 Bg7 g3 O-O Bg2 d6 O-O c6 Nc3 Bf5 Ng5 h6 e4 Bg4 f3 Bd7 Nh3 e5 d5 a5 Nf2 Na6 Nd3 Nh5 g4 Nf6 Be3 Nb4 Nf2 cxd5 cxd5 Rc8 Qd2 Kh7 Rfc1 Ng8 a3 Na6 Nd3 f5 h3 b5 Ne2 a4 Rxc8 Bxc8 Rc1 Bd7 Nb4 Nxb4 Qxb4 fxe4 fxe4 Qf6 Rc7 Bc8 Qc3 Ne7 Qd2 g5 Ng3 Ng6 Nf5 Nf4 Rxg7+ Qxg7 Nxg7 Kxg7 Bf1 Bd7 Kh2 Rc8 Bxf4 exf4 Bd3 Kf6 Qb4 Ke5 Bxb5 Rc2+ Kg1 Bxb5 Qxb5 Kxe4 Qxa4+,white,outoftime,E62,"King's Indian Defense: Fianchetto Variation, Larsen Defense",0 days 00:05:42.347000,44
pbiEpNZM,dimke1997,Horobetz,2390,2539,2017-10-17 11:36:02.336000+00:00,2017-10-17 11:41:18.708000+00:00,d4 f6 e4 g6 c4 Nh6 Nc3 Nf7 f4 Bg7 g4 O-O h4 d6 h5 e5 f5 exd4 Qxd4 g5 h6 Nxh6 Be2 Nc6 Qd3 Ne5 Qd1 Bd7 Be3 Nhf7 Qd2 h6 O-O-O c6 Nf3 Nxg4 Bd4 Nge5 Bxe5 fxe5 Rdg1 Qa5 Ne1 Bf6 Bh5 Kg7 Nf3 Qd8 Ne2 Qe7 Ng3 Be8 Bg6 Kg8 Nh5 Bg7 Bxf7+ Qxf7 Nxg5 hxg5 Qxg5 Qxc4+ Kb1 Qxe4+ Ka1 Rf7 f6 Qf3 Nxg7 Rxf6 Nxe8+ Kf7 Rh7+ Ke6 Qg8+ Rf7 Qxf7+ Qxf7 Rxf7 Kxf7 Nxd6+ Ke6 Ne4 Rf8 Nc3 Rf6 Re1 Rf5 a3 Rf4 Kb1 Kf5 Kc2 e4 Nd1 Rh4 Ne3+ Ke5 Rf1 Rh2+ Kc3 Rh3 Rf5+ Ke6 Kd4 Rxe3,black,outoftime,B00,Hippopotamus Defense,0 days 00:05:16.372000,53
AsC4LhLJ,Horobetz,dimke1997,2544,2386,2017-10-17 11:29:55.953000+00:00,2017-10-17 11:36:00.737000+00:00,e4 c5 Nc3 Nc6 f4 g6 Nf3 Bg7 Bc4 e6 f5 Nge7 fxe6 dxe6 d3 O-O O-O Na5 Bb3 b6 Qe1 Nec6 Bg5 Qc7 Qh4 Bb7 Kh1 Nxb3 axb3 f6 Bh6 a6 Qh3 Rae8 Na4 e5 Bxg7 Kxg7 Nc3 Nd4 Rf2 Rd8 Raf1 Qd7 Qxd7+ Rxd7 Nxe5 Re7 Nc4 b5 Nd6 Bc6 Nd5 Re6 Nc8 Rxc8 Nxf6 h5 Kg1 Re5 h4 Ne6 g4 c4 bxc4 bxc4 gxh5 gxh5 Rg2+ Kh8 Kh2 cxd3 cxd3 Bb5 Rf5 Rxf5 exf5 Nf4 Rg5 Rf8 Nxh5 Nxh5 Rxh5+ Kg7 d4 Kf6 Kg3 Rd8 Rg5 Rxd4 Rg8 Kxf5 Rf8+ Kg6 Rf2 Kh5 Rf5+ Kg6 Rf2 Bd7 Re2 Rd3+ Kf4 Bb5 Rc2 Kh5 Rg2 Kxh4 Rh2+ Rh3 Rxh3+ Kxh3 Ke3 Kg3 Kd2 Kf4 Kc3 Ke3 Kb3 Kd3 Ka3 Kc2 Ka2 a5 Ka1 Kb3 Kb1 Ka4 Ka1 Bc4 Kb1 Bd3+ Ka1 Bc4 Kb1 Bd3+ Ka1 Bc4,draw,draw,B23,"Sicilian Defense: Grand Prix Attack, Schofman Variation",0 days 00:06:04.784000,69
hSSCcU5L,dimke1997,Recobachess,2376,2360,2017-10-17 11:24:08.352000+00:00,2017-10-17 11:28:59.833000+00:00,d4 d6 Nf3 Nf6 g3 g6 Bg2 Bg7 O-O O-O c4 Nbd7 Nc3 e5 e4 Re8 h3 h6 Be3 a6 Re1 Kh7 Qc2 Bf8 Rad1 c6 c5 exd4 Nxd4 Nxc5 f4 Qc7 Bf2 Bg7 Nf3 Ne6 f5 Nf8 h4 Ng4 Bd4 Nd7 fxg6+ fxg6 h5 Nde5 hxg6+ Kxg6 Nh4+ Kh7 Nf5 Bh8 Rf1 Be6 Bh3 Rg8 Rf4 h5 Rdf1 Bf6 Bxg4 Rxg4 Rxg4 Nxg4 Bxf6 Nxf6 Qd2 Ng4 Qg5 Qf7 Ne7,white,outoftime,E68,"King's Indian Defense: Fianchetto Variation, Classical Variation",0 days 00:04:51.481000,35
5MWrBVOs,TheUnknownOnex,dimke1997,2307,2367,2017-10-17 11:20:02.728000+00:00,2017-10-17 11:23:53.663000+00:00,d4 Nf6 c4 g6 Nc3 Bg7 e4 d6 Be2 O-O Bg5 c5 d5 e6 Qd2 exd5 exd5 Qb6 Nf3 Bf5 Nh4 Ne4 Nxe4 Bxe4 f3 h6 Bxh6 Bxh6 Qxh6 Qxb2 Rc1 Bc2 g3 Ba4 Qd2 Qxd2+ Kxd2 Nd7 f4 Rfe8 Bd3 Kg7 Rb1 b5 cxb5 Nb6 Nf3 Nxd5 Rhc1 Re3 Ng5 Rae8 a3 f6 Rc4 fxg5 Rxa4 gxf4 Rxa7+ Kh6 b6 Rf3 b7 Rf2+ Kd1 Nc3+ Kc1 Re1#,black,mate,E75,"King's Indian Defense: Averbakh Variation, Main Line",0 days 00:03:50.935000,34
HMjDKOTd,dimke1997,TheUnknownOnex,2358,2316,2017-10-17 11:13:54.019000+00:00,2017-10-17 11:19:58.599000+00:00,d4 Nf6 Nf3 g6 c4 Bg7 g3 d5 cxd5 Nxd5 Bg2 O-O O-O Nb6 Nc3 Nc6 e3 Re8 a3 Rb8 Ne1 e5 d5 Na5 e4 c6 Nd3 cxd5 exd5 e4 Nb4 Nac4 Bf4 Ra8 Nxe4 a5 Nd3 Nxd5 Bc1 Bf5 Nec5 b6 Nb7 Qd7 Nf4 Nxf4 Bxf4 Qxd1 Raxd1 Nxb2 Rd6 Nc4 Rc6 Rac8 Bc7 Nd2 Rd1 Be4 Bxe4 Nxe4 f3 Nc3 Rd7 Re2 Nd6 Rf8 Bxb6 Nd5 Bc5 Rb8 Nb7 Ne3 Rcc7 Nf5 Rxf7 Bh6 Rxh7 Rbe8 h4 Re1+ Kg2 R8e2+ Kh3 Rh1+ Kg4 Ne3+ Bxe3 Bxe3 Rhe7 Kf8 Nd6 Bf4 Rf7+,white,outoftime,D76,Neo-Grünfeld Defense: Delayed Exchange Variation,0 days 00:06:04.580000,46
j3Op6zv8,TheUnknownOnex,dimke1997,2326,2348,2017-10-17 11:11:36.023000+00:00,2017-10-17 11:13:49.377000+00:00,d4 Nf6 c4 g6 Nc3 Bg7 e4 d6 Be2 O-O Bg5 c5 d5 e6 Qd2 exd5 exd5 Qb6 Nf3 Bf5 Nh4 Ne4 Nxe4 Bxe4 f3 h6 Be3 Qxb2 Rc1 Qf6 fxe4 Qxh4+ Bf2 Qe7 O-O Nd7 Be3 Kh7 e5 Nxe5 Rf4 f5 Rcf1 Rae8 Bf2 g5,black,resign,E75,"King's Indian Defense: Averbakh Variation, Main Line",0 days 00:02:13.354000,23
EvuBfctv,fbcaissafb1907,dimke1997,2342,2338,2017-10-17 11:07:23.414000+00:00,2017-10-17 11:10:49.301000+00:00,Nf3 Nf6 g3 g6 Bg2 Bg7 O-O O-O d3 d6 Nbd2 c5 e4 Nc6 c3 Bg4 Qc2 b5 h3 Bxf3 Nxf3 Nd7 a4 b4 Re1 Rb8 Nd2 bxc3 bxc3 Qa5 Ra3 Qa6 Nc4 Nde5 Nxe5 Nxe5 c4 Nc6 Be3 Nd4 Bxd4 Bxd4 Rb1 Rb4 Rxb4 cxb4 Ra2 Qb6 Qb3 a5 Kf1 Kg7 Ke2 f5 f3 fxe4 dxe4 e5 Rd2 Qc5 Kd1 Rc8 Bf1 Bc3 Rd3 Qf2 Rxc3 Qxf1+ Kc2 Qe2+ Kb1 bxc3 Qb7+ Kh6 g4 Qb2+,black,resign,A05,King's Indian Attack: Symmetrical Defense,0 days 00:03:25.887000,38
Z7xjVZRj,dimke1997,fbcaissafb1907,2349,2330,2017-10-17 11:01:10.871000+00:00,2017-10-17 11:07:19.638000+00:00,d4 Nf6 Nf3 e6 c4 c5 d5 exd5 cxd5 d6 Nc3 g6 Bf4 Bg7 Qa4+ Bd7 Qb3 Qc7 e4 O-O Bd3 Bg4 Nd2 a6 a4 b6 O-O Bc8 Nc4 Rd8 Rfe1 Nbd7 Nxd6 Nh5 Nxc8 Nxf4 Ne7+ Kf8 Bf1 Kxe7 d6+ Qxd6 g3 Bxc3 Qxc3 Ne6 e5 Qd4 Qf3 Rac8 Rad1 Qxb2 Bxa6 Rc7 Rxd7+ Rcxd7 Qf6+ Kf8 Qh8+ Ke7 Qf6+ Ke8 Bb5 Qd2 Re3 Qd1+ Kg2 Qd5+ Kg1 c4 Qh8+ Nf8 e6 fxe6 Qg7 Qxb5 Qg8 Qd5 h4 Qf5 h5 Qf7 Qh8 Rd3 Re4 c3 Qe5 c2 Qb5+ R3d7 Rc4 Qf5 Kg2 Qxb5 axb5 Rd2 Kf3 e5 Kg2 Ne6 h6 g5 g4 Nd4 Rc7 Rd1 Rxh7 c1=Q Rh8+ Kd7 Rxd8+ Kxd8 h7 Rg1+ Kh3 Rh1+ Kg2 Qg1#,black,mate,A61,Benoni Defense,0 days 00:06:08.767000,59
QPCeKyP2,dimke1997,khosromorphy,2337,2386,2017-10-17 07:14:32.811000+00:00,2017-10-17 07:18:25.445000+00:00,d4 e6 c4 Nf6 Nf3 d5 Nc3 Be7 Bg5 Nbd7 e3 a6 Rc1 b6 Qc2 Bb7 cxd5 exd5 Bd3 O-O O-O h6 Bh4 Rc8 Rfd1 c5 Bf5 c4 Ne5 b5 Bxf6 Nxf6 Bxc8 Qxc8 Ne2 Nd7 b3 Nxe5 dxe5 Ba3 Rb1 b4 Nf4 Rd8 Rd4 c3 h3 a5 Re1 Bc6 e6 fxe6 Nh5 e5 Rg4 e4 Rxg7+ Kh8 Qd1 Qf5 Qd4 Qf8 Rf7+ Kg8 Rxf8+ Kxf8 Qg7+ Ke8 Nf6#,white,mate,D37,Queen's Gambit Declined: Three Knights Variation,0 days 00:03:52.634000,34
f2g2tVcu,Tahaned2015,dimke1997,2306,2327,2017-10-16 20:02:05.420000+00:00,2017-10-16 20:06:09.443000+00:00,d4 Nf6 c4 g6 Nc3 Bg7 Nf3 d6 e4 O-O Be2 e5 Be3 Ng4 Bg5 f6 Bh4 Nc6 O-O Kh8 dxe5 Ngxe5 Nxe5 dxe5 Qxd8 Nxd8 Nd5 c6 Nc7 Rb8 Rad1 Ne6 Nxe6 Bxe6 Rd6 Rfe8 Rfd1 Kg8 c5 Kf7 b4 a5 a3 axb4 axb4 Ra8 h3 Bf8 Rxe6 Kxe6 Bc4+ Ke7 Rd6 Bg7 Re6+ Kf8,black,resign,E92,"King's Indian Defense: Orthodox Variation, Gligoric-Taimanov System",0 days 00:04:04.023000,28
2xKiyxuL,dimke1997,Tahaned2015,2316,2316,2017-10-16 19:56:28.133000+00:00,2017-10-16 20:01:59.334000+00:00,d4 Nf6 c4 e6 Nf3 c5 d5 exd5 cxd5 d6 Nc3 g6 Bf4 a6 Nd2 b5 a4 b4 Nce4 Be7 Nxf6+ Bxf6 Nc4 Be7 a5 O-O e3 Ra7 h4 h5 Be2 Bf5 g4 Be4 f3 Bxh4+ Kf1 f5 fxe4 fxg4 Kg2 g5 Rxh4 gxf4 Rxh5 f3+ Kh2 fxe2 Qxe2 Rg7 Rg1 Qe8 Rh4 Qxe4 Rhxg4 Qh7+ Kg3 Rf7 Nxd6 Rxg4+ Qxg4+ Rg7 Kf4 Rxg4+ Rxg4+ Kf8 Nf5 Nd7 e4 Qh2+ Rg3 Nf6 Ke5 Nh5 d6 Nxg3 d7 Nxf5+ Kxf5 Qh3+ Ke5 Qxd7 Kf4 Ke7 Ke3 Ke6 Kf4 Qd6+ Ke3 Qd4+ Kf3 c4 Kf4 c3 Kf3,white,outoftime,A61,Benoni Defense,0 days 00:05:31.201000,47
r4gUtDvY,Tahaned2015,dimke1997,2327,2305,2017-10-16 19:50:53.201000+00:00,2017-10-16 19:56:14.330000+00:00,d4 Nf6 c4 e6 Nf3 Bb4+ Nbd2 O-O e3 a5 Bd3 d6 O-O Nbd7 Qc2 Bxd2 Bxd2 e5 Bc3 Re8 dxe5 Nxe5 Nxe5 dxe5 Rad1 Qe7 Be2 Bg4 f3 Bd7 Kh1 Bc6 e4 Nd7 a3 a4 Bb4 Nc5 Qc3 b6 Qe3 Rab8 Rd2 Red8 Rfd1 Rxd2 Rxd2 h6 h3 Qg5 Bxc5 bxc5 Qxg5 hxg5 Kg1 Kf8 Kf2 Ke7 Bd1 Bd7 Rd5 Rxb2+ Kg3 Be6 Rxe5 Kd6 Rxg5 g6 Bxa4 Ra2 e5+ Ke7 Bc6 Rxa3 Bd5 c6 Bxe6 Kxe6 Rg4 Kxe5,black,outoftime,E11,Bogo-Indian Defense: Grünfeld Variation,0 days 00:05:21.129000,40
qzGkSTh8,Kutyuli,dimke1997,2355,2315,2017-10-12 21:33:57.367000+00:00,2017-10-12 21:38:46.418000+00:00,d4 Nf6 Bf4 d6 e3 g6 Nf3 Bg7 h3 O-O Be2 b6 O-O Bb7 a4 a6 c3 Nbd7 Nbd2 Ne4 Nxe4 Bxe4 Nd2 Bb7 Bf3 Qc8 Bxb7 Qxb7 Bh2 c5 Re1 b5 Qb3 Rfb8 Nf3 c4 Qc2 b4 e4 a5 e5 Qd5 exd6 exd6 Nd2 bxc3 bxc3 Rb7 Ne4 Bf8 Rab1 Rab8 Rxb7 Rxb7 Bg3 h6 h4 f5 Nd2 Nf6 Bf4 Nh5 Bh2 Re7 Rxe7 Bxe7 Qa2 Qe6 Qxc4 d5 Qf1 Bxh4 Nf3 Bf6 Be5 Be7 Qb5 Nf6 Qxa5 Ne4 Qb5 Nxc3 Qe8+ Kh7 Qh8#,white,mate,A45,Indian Defense,0 days 00:04:49.051000,42
xeHkJp0w,dimke1997,sisyphos33,2323,2387,2017-10-12 11:28:35.387000+00:00,2017-10-12 11:29:30.300000+00:00,d4 d5 c4 c6 Nc3 Nf6 e3 Bf5 cxd5 cxd5 Qb3 Nc6 Qxb7 Bd7 Qb3 e5 dxe5 Nxe5 Be2 Bd6 Nf3 O-O O-O Rb8 Qd1 Qe7 b3 Nxf3+ Bxf3 Qe5,black,resign,D10,Slav Defense,0 days 00:00:54.913000,15
WOnwDhzF,ana_baba_yala,dimke1997,2339,2333,2017-10-11 17:19:49.766000+00:00,2017-10-11 17:22:32.805000+00:00,g4 d5 Bg2 c6 g5 e5 d4 Nd7 h4 exd4 Qxd4 Qb6 Qxb6 Nxb6 b3 Bf5 c3 h6 Nf3 Be4 Nbd2 Bf5 Nd4 Bd7 e4 dxe4 Nxe4 O-O-O Bf4 Nd5 Bg3 hxg5 hxg5 Rxh1+ Bxh1 f5 gxf6 Ngxf6 Nxf6 gxf6 Bxd5 cxd5 O-O-O Bh6+ Kc2 f5 Rh1 Rh8 Be5 Rh7 Bf4,white,resign,A00,Grob Opening: Spike Attack,0 days 00:02:43.039000,25
SVOT8odn,Bengalas88,dimke1997,2343,2344,2017-10-08 15:09:39.970000+00:00,2017-10-08 15:15:47.301000+00:00,d4 Nf6 c4 e6 Nc3 Bb4 Qc2 O-O Nf3 c5 dxc5 Na6 g3 Nxc5 Bg2 Nfe4 O-O Bxc3 bxc3 d5 cxd5 exd5 Nd4 Be6 Rb1 Qe7 Ba3 Rfc8 Nb3 Qf6 Nxc5 Nxc5 Rfd1 Ne4 Bxe4 Rxc3 Bxh7+ Kh8 Bb2 Rxc2 Bxf6 Rcc8 Bxg7+ Kxh7 Bd4 b6 f3 Rc4 Rb2 Rac8 Kf2 Kg6 g4 Rc2 Rd2 Rxb2 Rxb2 Rc4 e3 f5 Kg3 fxg4 fxg4 Rc1 h3 Bd7 Rf2 Rc6 h4 Re6 h5+ Kh6 Rf7 Bc8 Kh4 Re4 Rf6+ Kh7 Rf4 Be6 Rxe4 dxe4 a3 Bc4 g5 Be2 g6+ Kg8 Kg5 Bb5 h6 Kf8 h7 Be8 h8=Q+ Ke7 Qf6+ Kd7 Qe5 Kd8 Kf6 Bd7 Qe7+ Kc8 Ke5 Kc7 Qd6+ Kd8 g7 Ke8 Kf6 Kd8 Qe7+ Kc7 g8=Q Kc6 Qc4+ Kb7 Qxd7+ Ka8 Qcc8#,white,mate,E32,Nimzo-Indian Defense: Classical Variation,0 days 00:06:07.331000,60
J0mLotys,FischersFrisoer,dimke1997,2350,2355,2017-10-07 21:33:44.270000+00:00,2017-10-07 21:35:11.965000+00:00,d4 Nf6 c4 g6 Nc3 Bg7 e4 d6 f3 O-O Be3 c5 d5 e6 Qd2 exd5 cxd5 a6 a4 Nbd7 Nh3 Re8 Be2 Ne5 Nf2 h5 O-O Nh7 Rab1 f5 b4 b6 bxc5 bxc5 Rb3 Nf6 Rfb1 fxe4 Nfxe4 Bf5 Nxf6+ Qxf6 R1b2 Nxf3+ Bxf3 Rxe3 Qxe3,white,resign,E81,"King's Indian Defense: Sämisch Variation, Sämisch Gambit",0 days 00:01:27.695000,23
Ow4sCYQG,dimke1997,damianovitch,2356,2314,2017-10-07 12:02:16.411000+00:00,2017-10-07 12:08:12.281000+00:00,d4 Nf6 Nf3 g6 c4 Bg7 g3 d6 Bg2 O-O O-O Nc6 Nc3 e5 dxe5 Nxe5 Nxe5 dxe5 Bg5 h6 Qxd8 Rxd8 Bxf6 Bxf6 Nd5 Bg5 Nxc7 Rb8 Nd5 Be6 Rfd1 Rbc8 h4 Bxd5 Rxd5 Rxd5 Bxd5 Be7 e3 b6 Rd1 Rd8 b3 Kf8 Kg2 f5 h5 g5 g4 f4 Kf3 Kg7 Ke4 Kf6 a3 a5 b4 axb4 axb4 Bxb4 Ra1 Bc5 Ra7 Be7 Rb7 Rd6 Rb8 Rd8 Rxb6+ Rd6 Rb7 Ra6 Rb8 Ra2 Rh8 Kg7 Rg8+ Kh7 Rb8 Kg7 Rb7 Kf6 Rb6+ Kg7 Rg6+ Kh7 Kxe5 Rxf2 Bg8+ Kh8 exf4 gxf4 Ke6 Bg5 Kf7 Re2 c5 f3 c6 f2 Kf8 f1=Q+ Bf7 Be7+ Ke8 Bc5+ Be6 Qf8+ Kd7 Qe7+ Kc8 Rxe6 Rxe6 Qxe6+ Kb7 Qe7+ c7 Bd6 Ka8 Qxc7 g5 Bf4 g6 Kg7,draw,stalemate,E62,"King's Indian Defense: Fianchetto Variation, Uhlmann-Szabo System",0 days 00:05:55.870000,62
s23cAUMx,Mirac_K,dimke1997,2398,2365,2017-10-06 22:41:22.222000+00:00,2017-10-06 22:43:45.812000+00:00,e4 c5 Nf3 d6 Bb5+ Bd7 Bxd7+ Qxd7 d4 cxd4 Qxd4 Nc6 Qd3 g6 c4 Bg7 Nc3 Nf6 O-O O-O a3 Qd8 b4 Nd7 Bb2 a5 b5 Nce5 Qe2 Nc5 Rad1 a4 Nxe5 Bxe5 f4 Bg7 e5 Qa5 Nd5 dxe5 Bc3 Qa7 b6 Qb8 Nc7 e4 Bxg7 Kxg7 Nxa8 Qxa8 Rd5 f5 Rxc5,white,resign,B52,"Sicilian Defense: Moscow Variation, Main Line",0 days 00:02:23.590000,26
pXaoAO52,dimke1997,Mirac_K,2352,2445,2017-10-06 22:37:20.759000+00:00,2017-10-06 22:41:18.146000+00:00,d4 e6 c4 Nf6 Nc3 Bb4 e3 c5 Ne2 Nc6 a3 Bxc3+ Nxc3 d5 dxc5 O-O cxd5 exd5 Bd3 Bg4 Ne2 Qe7 O-O a5 b3 Ne4 Bb2 Nxc5 Rc1 Rac8 Re1 Ne5 Bb1 Rfd8 h3 Bxh3 gxh3 Nf3+ Kh1 Qh4 Ng1 Ne4 Qxf3 Rxc1 Rxc1 g6 Bxe4 dxe4 Qf6,white,resign,E42,"Nimzo-Indian Defense: Hübner Variation, Rubinstein Variation",0 days 00:03:57.387000,24
XUMVogTs,dimke1997,muemmelmann,2359,2486,2017-10-06 14:48:13.630000+00:00,2017-10-06 14:51:30.267000+00:00,d4 Nf6 Nf3 g6 c4 Bg7 g3 O-O Bg2 c5 O-O cxd4 Nxd4 Nc6 Nc3 Nxd4 Qxd4 d6 Qd3 a6 Bf4 Bf5 e4 Be6 Rfd1 Rc8 b3 Qa5 Rac1 b5 cxb5 axb5 Qxb5 Qa3 Qa4 Qb2 Bd2 Ra8 Qb5 Rfb8 Qe2 Ra7 Nb5 Rxa2 Nc7 Bxb3,black,outoftime,E60,"King's Indian Defense: Normal Variation, King's Knight Variation",0 days 00:03:16.637000,23
s3R2pgnh,dimke1997,Unikum,2372,2307,2017-10-04 07:32:49.680000+00:00,2017-10-04 07:36:52.775000+00:00,d4 d5 c4 Nc6 Nf3 Bg4 Nc3 e6 Bf4 Bb4 e3 Nf6 Be2 O-O O-O dxc4 Bxc4 Nd5 h3 Bh5 Ne4 Nxf4 exf4 Bxf3 Qxf3 Nxd4 Qd3 Nc6 Qb3 Rb8 Rfd1 Qe7 a3 Bd6 Qf3 a6 Rd2 Bc5 Rad1 Rfd8 b4 Bb6 Ng5 h6 Nxf7 Kxf7 f5 Kg8 Bxe6+ Kh8 Rd7 Rxd7 Rxd7 Qf6 Rf7 Qa1+ Kh2 Ne5 Qh5 Nxf7 Bxf7 Bxf2,black,resign,D07,"Queen's Gambit Declined: Chigorin Defense, Main Line",0 days 00:04:03.095000,31
XTu6pk9I,Unikum,dimke1997,2305,2374,2017-10-04 07:30:00.646000+00:00,2017-10-04 07:32:45.086000+00:00,Nf3 Nf6 g3 g6 b3 Bg7 Bb2 O-O Bg2 d6 d4 Nbd7 O-O Re8 c4 c6 Nbd2 e5 dxe5 dxe5 Ng5 Nc5 Nge4 Nfxe4 Nxe4 Nxe4 Bxe4 Be6 Qxd8 Raxd8 Rad1 f6 Kg2 Bf8 Bc2 a5 Rxd8 Rxd8 Rd1 Rxd1 Bxd1 a4 Bc2 Kf7 Bc3 axb3 axb3 b5 cxb5 cxb5 e3 Bd5+ f3 Ke6 e4 Bc6 b4,draw,draw,A05,King's Indian Attack: Symmetrical Defense,0 days 00:02:44.440000,28
moM683BK,Quaritch79,dimke1997,2353,2385,2017-10-04 05:51:02.668000+00:00,2017-10-04 05:56:33.612000+00:00,e4 c6 d4 d5 Nc3 dxe4 Nxe4 Bf5 Ng3 Bg6 Nf3 e6 Bd3 Nd7 Be3 Ngf6 Qd2 Be7 O-O O-O c4 Qc7 Rfe1 Rfd8 Bxg6 hxg6 Qc2 c5 Rad1 Rac8 b3 cxd4 Nxd4 a6 Qe2 Bb4 Rf1 Nc5 h4 e5 Nc2 Bc3 h5 gxh5 Nxh5 Nxh5 Qxh5 Ne6 Bc1 f6 Ne3 Bd4 Nd5 Qf7 Qg4 Nc7 Ne3 Bxe3 Bxe3 f5 Qg5 Ne6 Qh4 f4 Bb6 Rxd1 Rxd1 e4 Rd5 Rc6 Rh5 Qg6 Rh8+ Kf7 Ba5 Rd6 Rb8 Rd7 Bc3 f3 g3 e3 fxe3 Qb1+ Kh2 Qc2+ Kh3 Qg2+ Kg4 f2 Qh5+ Ke7 Bb4+ Rd6 Qe8+ Kf6 Bc3+,white,outoftime,B18,Caro-Kann Defense: Classical Variation,0 days 00:05:30.944000,48
K23Bjkd0,dimke1997,Adminbrucefan,2395,2413,2017-10-03 14:06:45.838000+00:00,2017-10-03 14:11:32.788000+00:00,d4 Nf6 Nf3 g6 c4 Bg7 g3 c6 Nc3 d5 cxd5 cxd5 Ne5 O-O Bg2 e6 O-O Nfd7 f4 Nc6 Be3 Qb6 b3 Ndxe5 fxe5 Bxe5 Na4 Bxd4 Nxb6 Bxe3+ Kh1 Bxb6 e4 d4 Bh3 e5 Bxc8 Raxc8 Rc1 Rcd8 Qd3 Nb4 Qd2 Ba5 a3 Nc6 Qd3 Bc3 Rfd1 Bb2 Rc5 Bxa3 Rd5 Nb4 Rxd8 Nxd3 Rxf8+ Kxf8 Rxd3 f5 Rf3 Bc5 exf5 e4 Rf4 d3 fxg6+ Kg7 Kg2 Kxg6 Kf1 e3 Ke1 a5 Re4 Kf5 Re8 Kg4,black,resign,E60,"King's Indian Defense: Normal Variation, King's Knight Variation",0 days 00:04:46.950000,39
NYpT50Vv,dimke1997,russiandragon,2406,2411,2017-10-02 20:03:39.134000+00:00,2017-10-02 20:07:47.697000+00:00,d4 Nf6 Nf3 d6 g3 Nbd7 c4 e5 Nc3 Be7 Bg2 O-O O-O c6 Qc2 a6 Rd1 Qc7 h3 Re8 Be3 Bf8 Rac1 exd4 Bxd4 g6 e4 Bg7 g4 Rb8 b4 c5 bxc5 Nxc5 g5 Nfxe4 Nd5 Qd8 Bxg7 Kxg7 Qb2+ Kg8 Qd4 Be6 Nf6+ Nxf6 gxf6 Nd7 Qxd6 Qxf6 Nd4 Ne5,black,resign,A46,Indian Defense: Wade-Tartakower Defense,0 days 00:04:08.563000,26
Itensv8B,kawacoed,dimke1997,2367,2396,2017-10-02 19:54:55.978000+00:00,2017-10-02 20:00:47.891000+00:00,e4 c5 Nf3 d6 c3 Nf6 Be2 g6 Qc2 Qc7 O-O Bg7 h3 O-O d3 b6 Bf4 Nbd7 Nbd2 Bb7 Rac1 Rac8 Rfe1 Rfe8 Bf1 e5 Bg3 b5 a4 a6 axb5 axb5 Qb3 Bc6 Ng5 Rf8 f4 exf4 Bxf4 h6 Ngf3 Nh5 Bh2 Qb7 d4 cxd4 Nxd4 Nc5 Qc2 Rfe8 Bxd6 Nxe4 Nxe4 Bxe4 Qf2 b4 Bh2 bxc3 bxc3 Bd5 Rxe8+ Rxe8 Nf3 Nf6 Kh1 Ne4 Qc2 Qb6 Bg1 Ng3+ Kh2 Qb8 Bd3 Ne2+ Kh1 Nxc1 Qxc1 Bxf3 gxf3 Qg3 Qf1 Re1 Qg2 Qxg2+ Kxg2 Bxc3 Bf2 Re7 Be4 Kg7 Bc5 Rc7 Bd6 Rd7 Bc5 f5 Ba8 Rd8 Bb7 Rd7 Ba8 Rc7 Bd6 Ra7 Bd5 Rd7 Be5+ Bxe5,black,outoftime,B50,Sicilian Defense: Delayed Alapin,0 days 00:05:51.913000,54
AiJHs2qD,simut2017,dimke1997,2348,2408,2017-10-02 13:20:33.269000+00:00,2017-10-02 13:25:30.701000+00:00,e4 c6 d4 d5 Nc3 dxe4 Nxe4 Bf5 Ng3 Bg6 Nf3 Nd7 Bd3 e6 O-O Ngf6 Re1 Be7 c4 O-O Bxg6 hxg6 Qd3 Qc7 Bd2 Rfd8 Qc2 c5 d5 Nf8 dxe6 Nxe6 Bc3 Nd4 Bxd4 cxd4 Qd3 Rac8 b3 Bb4 Re2 Bc3 Rd1 Qc5 Ne4 Nxe4 Rxe4 Qa3 Ng5 Qa5 Rg4 f6 Ne6 f5 Rxg6 Qe5 Rxg7+ Qxg7 Nxg7 Kxg7 Qxf5 Re8 Qd7+ Kf6 g4 Rcd8 Qf5+ Kg7 Rd3 Rd6 Rh3 Rg6 Qd7+,white,resign,B18,Caro-Kann Defense: Classical Variation,0 days 00:04:57.432000,36
sNoNmK0B,dimke1997,simut2017,2399,2358,2017-10-02 13:16:02.557000+00:00,2017-10-02 13:20:13.933000+00:00,d4 Nf6 Nf3 g6 c4 Bg7 g3 O-O Bg2 d6 O-O Nbd7 Nc3 e5 e4 exd4 Nxd4 Nc5 h3 Re8 Re1 a5 Rb1 Bd7 Ndb5 Qc8 Kh2 h5 Bg5 Nh7 Be3 Bxb5 cxb5 Bxc3 bxc3 Nxe4 Qd4 Qf5 Bh6 Nhf6 Bxe4 Rxe4 Rxe4 Qxe4 Qxf6 Qe5 Qxe5 dxe5 Rd1 Kh7 Bg5 Kg7 Rd7 Rc8 Kg2 Kf8 Kf3 Ke8 Re7+ Kf8 Rxe5 c6 b6 c5 Bh6+ Kg8 Re7,white,resign,E68,"King's Indian Defense: Fianchetto Variation, Long Variation",0 days 00:04:11.376000,33
hSbN6Q7J,simut2017,dimke1997,2368,2389,2017-10-02 13:10:27.159000+00:00,2017-10-02 13:15:59.709000+00:00,e4 c5 Nf3 d6 Bb5+ Bd7 Bxd7+ Qxd7 O-O Nf6 Re1 Nc6 Nc3 e6 d4 cxd4 Nxd4 Be7 Bg5 h6 Bh4 O-O Nxc6 Qxc6 Qd3 Rfd8 Re2 Rac8 Rd1 a6 Nb1 b5 c3 Qb7 Nd2 a5 Nb3 Qb6 Nd4 b4 c4 a4 b3 axb3 axb3 Ra8 Nb5 Qc5 Kh1 Qh5 Bxf6 Bxf6 f4 Be7 Rf2 Qc5 Rdf1 Ra5 f5 d5 fxe6 dxc4 exf7+ Kf8 Qxc4 Qxb5 Qe6 Qc5 h3 Qe5 Qg6 Bd6 Rf4 Qxf4 Rxf4 Ra1+ Kh2 Bxf4+ g3 Rd2#,black,mate,B52,"Sicilian Defense: Moscow Variation, Main Line",0 days 00:05:32.550000,40
FBUOOA1i,leomessi_23,dimke1997,2551,2395,2017-10-02 13:06:15.320000+00:00,2017-10-02 13:09:55.795000+00:00,f4 c5 e3 Nc6 Nf3 g6 Bb5 Bg7 O-O Nf6 Qe1 O-O d3 Nb4 Na3 a6 Bc4 b5 Bb3 Bb7 Bd2 Nc6 Qh4 e6 Ng5 h6 Nf3 d5 c3 c4 Bc2 cxd3 Bxd3 Na5 Rad1 Qc7 Ne5 Rfd8 Be1 Ne4 Bxe4 dxe4 Bg3 Qb6 Rd4 Nc6 Nxc6 Bxc6 Nc2 Bxd4 Nxd4 Kg7 f5 exf5 Be5+ Kh7 Qf6,white,resign,A02,Bird Opening,0 days 00:03:40.475000,28
cfdDGTnP,dimke1997,Physiotherapist,2406,2377,2017-10-01 18:27:20.106000+00:00,2017-10-01 18:29:22.332000+00:00,d4 d5 c4 e5 dxe5 d4 a3 Nc6 e3 Bf5 Nf3 dxe3 Qxd8+ Rxd8 Bxe3 Nge7 Nc3 Ng6 Nd5 Rd7 Be2 Ncxe5 Nxe5 Nxe5 O-O c6 Nf4 a6 Rad1 Be7 Bd4 Bf6 Nh5 O-O Nxf6+ gxf6 Bb6 Bd3 Bxd3 Nxd3 Rd2 Ne5 Rfd1 Rxd2 Rxd2 Nxc4,black,resign,D08,Queen's Gambit Declined: Albin Countergambit,0 days 00:02:02.226000,23
tPB99awq,alt-left,dimke1997,2543,2413,2017-10-01 09:59:49.189000+00:00,2017-10-01 10:06:00.779000+00:00,b3 c5 Bb2 b6 e3 Bb7 f4 e6 Nf3 Nf6 g3 Be7 Bg2 d6 O-O O-O c4 Nbd7 Nc3 a6 d4 Qc7 d5 exd5 cxd5 Rfe8 a4 Bf8 Re1 g6 e4 Bg7 e5 dxe5 d6 Qc6 Nh4 Qc8 Nd5 Nxd5 Bxd5 exf4 Bxg7 Rxe1+ Qxe1 Kxg7 Bxb7 Qxb7 Rd1 f3 Qe7 Qc6 Qg5 Qe4 Qe7 Re8 Qxe4 Rxe4 Kf2 f5 Nxf3 Kf6 h4 h6 Rd3 Ke6 Nd2 Rd4 Rxd4 cxd4 Nf3 Kxd6 Nxd4 Kd5 Ke3 a5 h5 gxh5 Nxf5 Nc5 Ng7 Nxb3 Nxh5 Nc5 Nf4+ Kd6 Ne2 Nxa4 Nd4 Ke5 Nc6+ Kf5 Nd4+ Kg4 Kf2 Nc5 Nf3 a4 Ne5+ Kf5 Nc4 b5 Nd6+ Ke5 Nxb5 Kd5 Na3 Kd4 Kf3 Kc3 Kg4 Ne4 Nb5+ Kb4 Nd4 a3 Nc2+ Kb3 Nxa3 Kxa3 Kf4 Nf6 Kf5 Nh7 Kg6 Ng5 Kxh6 Nf7+ Kg7 Ne5 Kf6 Ng4+ Kg5 Ne5 Kf4 Ng6+ Kf5 Ne7+ Ke6 Ng6 g4 Kb4 g5 Kc5 Kf6 Nh4 Ke5 Kc6 Kf6 Kd7 Kf7 Kd6 Kf6,white,outoftime,A01,Nimzo-Larsen Attack: English Variation,0 days 00:06:11.590000,76
wmnn2Yag,dimke1997,alt-left,2409,2548,2017-10-01 09:53:50.148000+00:00,2017-10-01 09:59:46.876000+00:00,d4 e6 Nf3 b6 g3 Bb7 Bg2 f5 O-O Nf6 c4 a5 Nc3 Bb4 Qc2 O-O Bg5 Bxc3 Qxc3 d6 Rfe1 Nbd7 Bh3 Qe8 Bxf6 Nxf6 Nd2 Qh5 Bg2 Bxg2 Kxg2 Rae8 e4 f4 f3 e5 g4 Qg5 dxe5 dxe5 Nf1 h5 h3 Nd7 Rad1 Nc5 Rd5 hxg4 hxg4 c6 Rd6 Rf6 Red1 Kf7 b4 axb4 Qxb4 Nxe4 Rd7+ Kg6 Qxb6 Ng3 Nxg3 fxg3 Qc7 Rg8 R1d6 e4 Rxf6+ gxf6 Qxg3 Qa5 Qh4 exf3+ Kh3 Rg7 Rd6 Qg5 Qh5+ Qxh5+ gxh5+ Kg5 Kg3 Rh7 Kxf3 Rxh5 Rxc6 Rh3+ Kg2 Ra3 Rc8 Rxa2+ Kg3 Ra3+ Kg2 f5 c5 Kf4 c6 Ra2+ Kf1 Rc2 c7 Kf3 Ke1 f4 Kd1 Rc6 Kd2 Kf2 Kd1 f3 Kd2 Rd6+ Kc2 Rc6+ Kd2 Rd6+ Kc2 Rc6+ Kd2,draw,draw,A40,Horwitz Defense,0 days 00:05:56.728000,60
WwnkxIYr,alt-left,dimke1997,2567,2394,2017-10-01 09:48:01.079000+00:00,2017-10-01 09:53:47.076000+00:00,b3 c5 Bb2 Nc6 e3 e5 Ne2 g6 d4 exd4 exd4 Bg7 Nd2 Nge7 Nf3 O-O Qc1 cxd4 Nexd4 d5 Be2 Re8 O-O Nf5 Nxc6 bxc6 Bxg7 Kxg7 Bd3 Qf6 Qd2 Bd7 Bxf5 Bxf5 Rfe1 Be4 Nd4 c5 Nb5 Rab8 Nc3 Qd4 Qxd4+ cxd4 Ne2 d3 cxd3 Bxd3 Nf4 Ba6 Nxd5 Rxe1+ Rxe1 Rd8 Nb4 Bb7 f3 a5 Nc2 Rd2 Rc1 Ba6 a3 Rd3 b4 Rc3 Kf2 Bd3 bxa5 Rxc2+ Rxc2 Bxc2 a6 Ba4 Ke3 g5 Kd4 Bc6 Kc5 Ba8 Kb6 h5 Ka7 Bd5 Kb8 g4 fxg4 Bxg2 a7 hxg4 a4 f5 a5 f4 a6 Bc6 a8=Q Bxa8 Kxa8 f3 a7 f2 Kb7 f1=Q a8=Q Qf7+ Kb6 Qb3+ Kc5 Qc2+ Kd4 Qxh2,black,outoftime,A01,Nimzo-Larsen Attack: English Variation,0 days 00:05:45.997000,56
N0cJ9lTa,dimke1997,alt-left,2400,2559,2017-10-01 09:44:48.241000+00:00,2017-10-01 09:47:54.840000+00:00,d4 e6 c4 f5 Nf3 Nf6 g3 Bb4+ Bd2 Bxd2+ Qxd2 b6 Bg2 Bb7 O-O Ne4 Qc2 O-O Nc3 Nxc3 Qxc3 Qe7 Rfe1 Be4 Bf1 d6 Nd2 Bb7 e4 fxe4 Nxe4 Qf7 f4 h6 Bg2 Nc6 Rad1 Rae8 b4 a5 b5 Nd8 a4 e5 fxe5 dxe5 d5 Qg6 c5 Nf7 d6 cxd6 c6 Bc8 Qd3 Bf5 Qa3 Bxe4 Bxe4 Qf6 Rf1 Qe7 Qxd6 Nxd6,black,resign,A84,Dutch Defense: Classical Variation,0 days 00:03:06.599000,32
LEodXhpD,dimke1997,Chaozu,2409,2434,2017-09-30 22:14:08.568000+00:00,2017-09-30 22:16:46.197000+00:00,b3 g6 Bb2 Nf6 g4 Bg7 h4 h6 e3 d5 Be2 c5 Nh3 Nc6 g5 hxg5 Nxg5 Nh5 d4 cxd4 exd4 Bf5 Qd2 Qd6 Na3 a6 c4 Nf4 O-O-O Nxe2+ Qxe2 Nxd4 Rxd4 Bxd4 Bxd4 Qxa3+ Bb2 Qxa2 Re1 Qb1+,black,resign,A01,Nimzo-Larsen Attack: Spike Variation,0 days 00:02:37.629000,20
X6ASdTbE,Chaozu,dimke1997,2423,2420,2017-09-30 22:08:04.454000+00:00,2017-09-30 22:14:04.421000+00:00,e4 c6 d4 d5 exd5 cxd5 c4 Nf6 Nc3 Nc6 Bg5 Be6 Be2 Qa5 Bf3 dxc4 Bxf6 exf6 d5 O-O-O Ne2 Ne5 Nd4 Nd3+ Kf1 Bd7 Qc2 Bc5 Nce2 Ne5 b4 Bxb4 Rb1 Ba4 Qf5+ Kb8 a3 Bc5 Nc6+ Nxc6 dxc6 Bb3 cxb7 Qd2 Qf4+ Qxf4 Nxf4 Rd2 Nh3 Re8 g3 Bc2 Rb5 Bf5 Kg2 Bxh3+ Kxh3 Bxf2 Rc1 Rd4 Rc5 Rh4+ Kxh4 Bxc5 Rxc4 Re5 Kh3 h5 Kg2 g5 h3 f5 Bxh5 Kxb7 Bxf7 Kc6 Rc2 Re3 Bg6 Rxa3 Bxf5 Re3 Rd2,white,outoftime,B13,"Caro-Kann Defense: Panov Attack, Modern Defense",0 days 00:05:59.967000,41
CIhuT90A,dimke1997,Chaozu,2431,2412,2017-09-30 22:03:24.670000+00:00,2017-09-30 22:08:01.527000+00:00,d4 Nf6 Nf3 e6 c4 Nc6 a3 d6 Nc3 g6 e4 Bg7 h3 O-O Be3 Re8 Bd3 Nh5 Be2 Nf6 O-O e5 d5 Nd4 Nxd4 exd4 Bxd4 Nxe4 Bxg7 Kxg7 Nxe4 Rxe4 Bd3 Re8 Qf3 Qf6 Qxf6+ Kxf6 Rfe1 Bd7 f4 a5 b3 Ra6 Kf2 Rxe1 Rxe1 Rb6 Bc2 Bf5 Bxf5 Kxf5 Re3 Kf6 Kf3 c6 dxc6 bxc6 g4 h6 h4 h5 g5+ Kf5 Rd3 Ke6 Re3+ Kd7 f5 Rb7 Kf4 c5 Rd3 a4 bxa4 Ra7 Rb3 Rxa4 Rb7+ Kc6 Rxf7 Rxc4+ Kf3 gxf5 Rxf5 Rxh4 g6 Rg4 Rxh5 Rxg6 Rh4 Re6 a4 d5,black,resign,E10,Indian Defense: Anti-Nimzo-Indian,0 days 00:04:36.857000,47
zJxCOXRI,Chaozu,dimke1997,2399,2442,2017-09-30 22:02:34.906000+00:00,2017-09-30 22:03:20.959000+00:00,e4 c5 d4 cxd4 c3 Nf6 e5 Nd5 Nf3 d6 exd6 Bg4 Bc4 Nb6 Bxf7+ Kxf7 Ne5+,white,resign,B22,"Sicilian Defense: Alapin Variation, Smith-Morra Declined",0 days 00:00:46.053000,8
H2DY3wCM,dimke1997,Chaozu,2433,2410,2017-09-30 21:56:23.119000+00:00,2017-09-30 22:02:31.115000+00:00,d4 Nf6 Nf3 e6 c4 c5 d5 exd5 cxd5 d6 Nc3 g6 Bf4 a6 Nd2 Bg7 Nc4 O-O Nxd6 b5 h3 Nbd7 e3 Nb6 Be2 b4 Nce4 Nfxd5 O-O Bxb2 Rb1 Nc3 Qc2 Nxe2+ Qxe2 Bg7 Rfd1 Be6 Nxc5 Qe7 Rxb4 Nd5 Rb7 Nxf4 exf4 Qf6 Nxe6 fxe6 Ne4 Qxf4 Rdd7 Be5 g3 Qf5 Rxh7 Rac8 h4 Qh3 Qd1 Rfd8 Rhd7 Rxd7 Rxd7 Qf5 Ng5 Bf6 Nf7 Bg7 Qd2 Rc2 Qe3 Rxa2 Ng5 Bf8 Kg2 e5 Rd2 Qe6 Rxa2 Qb6 Qxe5 Qb8 Qe6+ Kg7 Qf6+ Kxf6 Ne4+ Kg7 Rxa6 Qb7 Rxg6+ Kxg6 h5+,white,outoftime,A61,Benoni Defense,0 days 00:06:07.996000,46
