game_id,white_player,black_player,white_elo,black_elo,game_started_at,game_ended_at,moves,winner,status,eco,name_of_opening,game_duration,num_of_moves
iyfQstO6,Grau,dimke1997,2365,2430,2020-12-08 22:12:30.333000+00:00,2020-12-08 22:18:27.297000+00:00,d4 Nf6 c4 g6 Nc3 Bg7 e4 d6 f3 O-O Bg5 c5 d5 e6 a4 exd5 cxd5 a6 Nge2 Nbd7 Ng3 h6 Be3 Nh7 Be2 h5 O-O h4 Nh1 f5 Qd2 Re8 Nf2 Ne5 f4 Nf7 e5 dxe5 fxe5 Nxe5 Bxc5 b6 Ba3 Bb7 Rad1 Ng5 d6 h3 Nxh3 Nxh3+ gxh3 Qh4 Qf4 Qxf4 Rxf4 Bh6 Rb4 Be3+ Kf1 Nf3 Nd5 Nd2+ Rxd2 Bxd2 Nf6+ Kf7 Nxe8 Bxb4 Bxb4 Rxe8 Bc4+ Kg7 Bc3+ Kh7 d7 Rd8 Be6 Bc6 Bf6 Rxd7 Bxd7 Bxd7 b3 Be6 b4 Bd7 a5 b5 Kf2 Kg8 Bd4 Kf7 Kg3 Ke6 Kf4 Kd5 Bc5 Kc4 h4 Kd5 h5 gxh5 Kg5 Ke4 Kxh5 f4 Kh4 Kf3 h3 Kg2 Bb6 Bxh3 Bc7 f3 Bb6 Be6 Kg5 f2 Kf6 f1=Q+ Kxe6 Qc4+,black,outoftime,E81,King's Indian Defense: Steiner Attack,0 days 00:05:56.964000,61
RGihde4a,dimke1997,Sershah2009,2431,2332,2020-12-08 16:44:38.477000+00:00,2020-12-08 16:50:47.468000+00:00,d4 d6 g3 e5 dxe5 dxe5 Qxd8+ Kxd8 Nc3 c6 f4 Nd7 Nf3 f6 fxe5 Nxe5 Nxe5 fxe5 Bg5+ Be7 O-O-O+ Kc7 Ne4 h6 Bxe7 Nxe7 Bg2 Bg4 h3 Bf5 g4 Bxe4 Bxe4 Rhf8 Rhf1 Rf4 Rxf4 exf4 h4 Rd8 Rf1 g5 hxg5 hxg5 Rh1 Nd5 Rh7+ Kb6 Rg7 Ne3 b3 Rd1+ Kb2 Nxg4 Rxg5 Ne3 Bd3 Rf1 a4 a5 Rg7 f3 exf3 Rxf3 Re7 Nd5 Re4 Rf2 Rh4 Nb4 Rh3 Rd2 Kc3 Rg2 Rh5 Rg3 Rf5 Nd5+ Kb2 Nb4 Be4 Re3 Rf4 Re2 Kc3 Re3+ Kb2 Rg3 Rf3 Rg4 Bd3 Rh4 Rg3 Rh2 Rf3 Kc5 Rg3 Kb6 Rf3 Rh6 Rg3 Rd6 Rf3 Nxd3+ cxd3 Kc5 Kc3 Kb6 Rf5 Rh6 Rf4 Rh1 Rc4 Rc1+ Kb2 Rd1 Kc3 Re1 Kd4 Rf1 Rc2 Rf5 Kc3 Rd5 d4 Rh5 Kd3 Rh3+ Kc4 Rg3 Rc3 Rxc3+ Kxc3 Kc7 Kc4 Kd6 Kc3 Ke6 Kd3 Kd5 Kc3 Ke4 Kc4 Ke3 d5 cxd5+ Kxd5 Kd3 Kc5 Kc3 Kb5 Kxb3 Kxa5 Ka3 Kb5 b6 a5 bxa5 Kxa5,draw,draw,A41,Queen's Pawn Game,0 days 00:06:08.991000,79
WZlTZK2m,dimke1997,CaptainPlanet,2426,2409,2020-12-08 14:17:25.005000+00:00,2020-12-08 14:20:36.978000+00:00,d4 d5 c4 dxc4 Nf3 c5 e3 cxd4 Bxc4 Qc7 Qb3 e6 Nxd4 a6 O-O Bd6 f4 Nf6 Nc3 O-O Bd2 e5 Nde2 Nc6 Nd5 Nxd5 Bxd5 Rd8 Rac1 Qe7 f5 Qf6 Ng3 Bb8 Ne4 Qe7 f6 Qd7 fxg7 Na5,white,resign,D21,Queen's Gambit Accepted: Gunsberg Defense,0 days 00:03:11.973000,20
mvOGA9SS,supertolchok,dimke1997,2427,2432,2020-12-08 08:26:32.459000+00:00,2020-12-08 08:29:59.127000+00:00,e4 c5 Nf3 Nc6 d4 cxd4 Nxd4 Nf6 Nc3 d6 Nxc6 bxc6 Bd3 g6 O-O Bg7 Bg5 O-O Qd2 Rb8 Rab1 Qa5 h3 e5 Nd5 Qxd2 Nxf6+ Bxf6 Bxd2 d5 b4 Be6 a4 Rfd8 Bc3 Bg7 f4 dxe4 Bxe4 exf4 Bxg7 Kxg7 Bxc6 Rd4 b5 Rxa4 b6 Ra3 bxa7 Rxb1 a8=Q Rxf1+ Kxf1 Rxa8 Bxa8 Kf6 Kf2 Ke5 c3 g5 Kf3 f5 Bc6,white,timeout,B56,Sicilian Defense: Classical Variation,0 days 00:03:26.668000,31
pB7EGFx7,dimke1997,rigoletto1971,2425,2474,2020-12-08 08:23:03.784000+00:00,2020-12-08 08:26:18.103000+00:00,d4 Nf6 Nf3 c5 d5 e6 c4 exd5 cxd5 d6 Nc3 a6 Bf4 g6 Nd2 b5 a4 b4 Nce4 Nxd5 Bxd6 Bxd6 Nc4 Be7 Ned6+ Bxd6 Qxd5 O-O Qxa8 Be6 e3 Qf6 O-O-O Bxc4 Bxc4 Be5 Rd2 Nc6 Qxa6 Bxb2+ Rxb2 Qc3+ Kb1 Ne5 Rc1 Qa3 Ra2 Nxc4 Qxc4,white,resign,A43,"Benoni Defense: Benoni-Indian Defense, Kingside Move Order",0 days 00:03:14.319000,24
N3eRSVj3,flo50,dimke1997,2373,2420,2020-12-07 19:21:51.727000+00:00,2020-12-07 19:27:59.399000+00:00,e4 c5 Nf3 Nc6 Bb5 Nf6 e5 Nd5 Nc3 Nc7 O-O Nxb5 Nxb5 g6 Re1 Bg7 d4 cxd4 Nbxd4 Kf8 Bf4 h6 Qd2 Kg8 Rad1 Kh7 c3 Qa5 h4 b6 h5 g5 Bxg5 hxg5 Nxg5+ Kg8 Nxc6 dxc6 Qd8+ Bf8 Qe8 Qxa2 e6 Bxe6 Qxa8 Bd5 Rxe7 Qa4 Rde1 Qg4 Ne4 Kg7 Re5 Bd6 Rg5+ Qxg5 Nxg5 Rxa8 f3 Bc5+ Kh2 Rh8 g4 Kf6 Ne4+ Bxe4 Rxe4 Kg5 Kg3 f5 f4+ Kf6 g5+ Kf7 Re5 Rxh5 Rxf5+ Kg7 Kg4 Rh2 Rf6 Rxb2 Rxc6 a5 Rc7+ Kf8 f5 a4 Kh5 a3 Kg6 Ke8 f6 a2 Ra7 b5 Kg7 Rf2 g6 Bxa7 f7+ Ke7 Kg8 a1=Q g7 Qf1 f8=Q+ Rxf8+ gxf8=Q+ Qxf8+ Kh7 Qf5+ Kg7 Qg5+ Kh7 Kf7 Kh8 Qh5#,black,mate,B30,Sicilian Defense: Nyezhmetdinov-Rossolimo Attack,0 days 00:06:07.672000,59
rbuLS2uy,dimke1997,Shevizuki,2415,2381,2020-12-07 19:18:11.755000+00:00,2020-12-07 19:21:11.826000+00:00,d4 c5 d5 e6 c4 Nf6 Nc3 exd5 cxd5 d6 Nf3 g6 Bf4 Bg7 Qa4+ Bd7 Qb3 Qc7 e4 O-O Nd2 Re8 Be2 Ng4 Bxg4 Bxg4 O-O a6 a4 Nd7 h3 Bh5 g4 Be5 Bxe5 Nxe5 gxh5 Qe7 f4 Nd3 Ne2 Nb4 Kh2 f5 hxg6 hxg6 Ng3 fxe4 Ndxe4 Rac8 Qc3 Nxd5 Qc4 Qf7 Qxd5,white,resign,A61,Benoni Defense,0 days 00:03:00.071000,27
vOObENK9,dimke1997,chEssUnited_1,2421,2372,2020-12-05 00:44:27.387000+00:00,2020-12-05 00:47:19.622000+00:00,d4 c5 d5 d6 e4 a6 a4 Nf6 Nc3 g6 h3 e6 dxe6 Bxe6 Bg5 Bg7 e5 dxe5 Qxd8+ Kxd8 Ne4 Nd7 O-O-O Ke7 Nf3 b5 axb5 axb5 Bxb5 h6 Bxd7 hxg5 Nxf6 Bxf6 Bxe6 Kxe6 c3 g4 hxg4 Rxh1 Rxh1 Ra1+,black,resign,A43,Benoni Defense: Old Benoni,0 days 00:02:52.235000,21
nDnO1WuB,RobGordon,dimke1997,2551,2425,2020-12-04 23:44:48.359000+00:00,2020-12-04 23:48:01.543000+00:00,c4 Nf6 Nc3 g6 e4 d6 d4 Bg7 Bd3 O-O Nf3 Bg4 Be3 Nc6 Ne2 Bxf3 gxf3 Nd7 Qd2 e5 d5 Nd4 Bxd4 exd4 f4 c5 h4 Re8 h5 Nf6 Ng3 a6 O-O-O b5 hxg6 hxg6 f3 Rb8 e5 dxe5 f5 e4 fxe4 bxc4 Bxc4 Nxe4 Nxe4 Rxe4 fxg6 fxg6 d6+ Kf8 Rhf1+ Ke8 Rf7,white,resign,E70,King's Indian Defense: Normal Variation,0 days 00:03:13.184000,27
X4doTf1E,dimke1997,jelzincompany,2431,2374,2020-12-04 01:59:20.860000+00:00,2020-12-04 02:05:36.632000+00:00,d4 Nf6 Nf3 e6 c4 d5 Nc3 Bb4 Qa4+ Nc6 e3 O-O Qc2 a6 Bd2 Re8 h3 h6 Rd1 b6 a3 Bxc3 Bxc3 Bb7 Bd3 Ne7 Ne5 Rc8 O-O c5 dxc5 bxc5 cxd5 exd5 Qa4 Qb6 Qh4 Rcd8 Ng4 Nxg4 Qxg4 Ng6 h4 d4 exd4 cxd4 Bxg6 dxc3 Bb1 Rxd1 Rxd1 Qxb2 Qd7 Rf8 Qd3 f5 Re1 Be4 Qc4+ Kh8 Bxe4 fxe4 h5 Qd2 Re2 Qd3 Qxe4 Qxe4 Rxe4 Rc8 Re1 Kg8 Rc1 Kf7 Kf1 Ke6 Ke2 Kd5 Kd3 Rf8 Rxc3 Rxf2 Rc2 Rf5 Re2 Rxh5 Kc3 Rg5 Rd2+ Kc5 Re2 Rg3+ Kb2 Kb5 Re4 Rxg2+ Kb3 Rg3+ Kb2 h5 Re5+ Kc4 Rxh5 g5 Kc1 a5 Rh7 Kb3 Rc7 Kxa3 Rb7 Ka4 Kd2 Rg2+ Ke3 Rg3+ Ke2 Rb3 Rc7 Rb4 Rg7 Kb3 Rxg5 Rc4 Rg3+ Rc3 Rxc3+ Kxc3 Kd1 Kb2 Kd2 a4 Kd3 a3 Kc4 a2 Kb4 a1=Q,black,outoftime,D38,"Queen's Gambit Declined: Ragozin Defense, Alekhine Variation",0 days 00:06:15.772000,69
tAGPBp8V,wallace16,dimke1997,1971,2431,2020-12-03 12:53:38.899000+00:00,2020-12-03 12:59:19.587000+00:00,f3 O-O Be3 c5 d5 e6 Bd3 exd5 cxd5 a6 a4 Re8 Nge2 Nbd7 Qd2 h5 O-O Nh7 b3 Ne5 Bc2 Rb8 h3 f5 exf5 gxf5 Nf4 Nc4 bxc4 Rxe3 Nfe2 Qe7 Kh1 Bd7 Rae1 Re8 Ne4 Rxe2 Rxe2 fxe4 Rxe4 Qf7 Rxe8+ Bxe8 Re1 Be5 Qd3 Ng5 h4 Qf4 Kg1 Qxh4 f4 Bd4+ Kf1 Qf2#,black,mate,unknown,unknown,0 days 00:05:40.688000,28
ZdMnMWKt,dimke1997,pzkpfwvi,2429,2098,2020-12-03 12:48:13.313000+00:00,2020-12-03 12:53:10.460000+00:00,Nf3 O-O Be2 e5 O-O Nc6 d5 Ne7 Ne1 Nd7 Be3 f5 f3 f4 Bf2 g5 Nd3 Rf7 c5 Nf6 Rc1 Bf8 cxd6 cxd6 Nb5 Ne8 a4 a6 Na3 Ng6 Nc4 b5 Nb6 Rb8 Nxc8 Rxc8 Rxc8 Qxc8 axb5 axb5 Qb3 h5 Rc1 Qd7 Ra1 g4 Ra7 Nc7 Bb6 gxf3 Bxf3 Qc8 Qc2 Nh4 Rxc7 Nxf3+ gxf3 Rxc7 Qxc7 Qh3 Ne1 b4 Bf2 b3 Qd8 Kf7 Qh4 Qc8 Qxh5+ Kg8 Qg4+ Qxg4+ fxg4,white,resign,unknown,unknown,0 days 00:04:57.147000,36
6wBGpVzL,Dimka85,dimke1997,1881,2429,2020-12-03 12:44:59.803000+00:00,2020-12-03 12:47:55.027000+00:00,Bd3 O-O Be3 Nc6 Qd2 Ng4 Nge2 Nxe3 fxe3 e5 d5 Ne7 O-O f5 exf5 gxf5 e4 f4 Rf2 Ng6 Raf1 Bf6 Rc1 Bh4 Rff1 Qg5 Kh1 Qh5 c5 Bg5 Ng1 Bg4 Be2 f3 gxf3 Bxd2 fxg4 Qh6 Rc2 Bf4 Nf3 Nh4 Nxh4 Qxh4 Bf3 Rf6 cxd6 cxd6 Nb5 Raf8 Nxa7 Be3 Kg2 Bxa7,black,resign,unknown,unknown,0 days 00:02:55.224000,27
M1Njqnnl,dimke1997,Genka1103,2428,1952,2020-12-03 12:38:18.526000+00:00,2020-12-03 12:44:27.363000+00:00,Nf3 O-O Be2 Nbd7 O-O c5 h3 a6 Be3 cxd4 Nxd4 Qc7 Rc1 b6 Nd5 Nxd5 cxd5 Qb7 Nc6 Nc5 Bd4 e5 Bxc5 bxc5 Rb1 a5 a4 f5 exf5 Bxf5 Bd3 e4 Bc4 Rf7 Nxa5 Rxa5 b3 e3 fxe3 Bxb1 Qxb1 Rxf1+ Qxf1 Qf7 Qe1 Be5 Qxa5 Kg7 Qe1 Qf5 Qf1 Qe4 Qe1 Bf4 Kf2 Bg5 a5 Bh4+ g3 Bf6 a6 Qf5+ Kg2 Qc2+ Qe2 Qe4+ Kh2 Qe7 Qa2 Qa7 Qa5 Kh6 Qb5 Bc3 Qb7 Qxb7 axb7 Be5 b8=Q g5 Qf8+ Bg7 Qf3 Bf6 g4 Be5+ Kg2 Kg6 Qf5+ Kg7 Bd3 Kg8 Qxh7+ Kf8 Bf5,white,outoftime,unknown,unknown,0 days 00:06:08.837000,47
iIGKO6gB,Lusrsenbu91,dimke1997,1989,2427,2020-12-03 12:31:21.167000+00:00,2020-12-03 12:37:54.543000+00:00,Bd3 O-O Nf3 Bg4 O-O Nc6 h3 Bxf3 Qxf3 Nxd4 Qd1 c5 Nd5 Nd7 Bg5 Re8 Rc1 h6 Bh4 g5 Bg3 e6 Ne3 Ne5 b3 a6 Bb1 b5 Ng4 Nxg4 Qxg4 bxc4 bxc4 Rb8 h4 Rb2 hxg5 Qxg5 Qxg5 hxg5 Bxd6 Ne2+ Kh1 Nxc1 Rxc1 Bd4 f3 e5 Bc7 Re6 Kh2 Bf2 Kh3 Be3 Rd1 Rh6+ Kg4 Rh4+ Kf5 Rf4+ Kxe5 Bd4+ Kd5 Rf6 e5 Re6 Bf5 Re8 e6 fxe6+ Bxe6+ Kg7 g4 Re2 Bf5 Rxa2 Rh1 Rd2 Rh7+ Kg8 Kc6 a5 Bxa5 Ra2 Bb6 Ra6 Kb7 Ra1 Bc7 Rb1+ Kc6 Rf8 Rh6 Re1 Rg6+ Kf7 Bd6 Rg8 Rh6 Be5 Rh7+ Rg7 Bxe5 Rxh7 Bxh7 Rxe5 Bf5 Kf6 Kd6 Re3 Kxc5 Rxf3 Kd5 Rc3 c5 Ke7 Kc6 Kd8 Be6 Ra3 Bf5 Rb3 Be6 Rf3 Bf5 Re3 Be6 Rxe6+ Kd5 Rh6 c6 Kc7 Ke5 Rxc6 Kf5 Rc5+ Kg6 Kd6,black,outoftime,unknown,unknown,0 days 00:06:33.376000,69
PlYLI2dC,dimke1997,Vincent-VVP,2438,1989,2020-12-03 12:26:25.531000+00:00,2020-12-03 12:30:51.252000+00:00,Nf3 Bg4 Be2 O-O Be3 Nbd7 O-O e5 d5 Nc5 Nd2 Bxe2 Qxe2 a6 b4 Ncd7 c5 Qe7 Nb3 Rac8 Rac1 Rfd8 c6 bxc6 dxc6 Nb8 Nd5 Nxd5 exd5 f5 f3 Rf8 a4 Rce8 b5 f4 Bf2 axb5 axb5 e4 fxe4 Qxe4 Qxe4 Rxe4 b6 Re7 bxc7 Rxc7 Bb6 Rcc8 Nd4 Bxd4+ Bxd4 Na6 Bb6 Nb4 Rcd1 Rf5 Rd4 Nxd5 Ba5 Rxc6 Rfd1 Ne3 Ra1 Rc2 Bb4 Rxg2+ Kh1 Rh5 Ra8+ Kg7 Rxf4 Rhxh2#,black,mate,unknown,unknown,0 days 00:04:25.721000,37
C9RrIxLZ,dimke1997,uthal,2437,1704,2020-12-03 12:21:13.330000+00:00,2020-12-03 12:26:11.569000+00:00,Nf3 O-O Be2 Bg4 Be3 c6 O-O d5 e5 Ne4 Qc2 Bf5 Qb3 b6 cxd5 cxd5 Nxd5 Nc6 Nc3 Rc8 Rfd1 Qc7 Rac1 Qb7 Qa4 Nxc3 bxc3 b5 Qxb5 Qxb5 Bxb5 Na5 c4 f6 exf6 Bxf6 d5 Bb2 c5 Bxc1 Rxc1 Rfd8 Rd1 a6 Bxa6 Ra8 Bb5 Nb7 Bc6 Nxc5 Bxa8 Rxa8 Bxc5 Rxa2 Bxe7 Kg7 d6 Bd7 h3 Ra6 Ne5 Rxd6 Rxd6 Be6 Rxe6,white,outoftime,unknown,unknown,0 days 00:04:58.239000,32
5Avt1vnd,dimke1997,KarpenkoSergey,2443,2479,2020-12-03 00:46:55.812000+00:00,2020-12-03 00:52:52.288000+00:00,d4 Nf6 Nf3 g6 c4 Bg7 g3 O-O Bg2 c6 O-O d5 Qb3 dxc4 Qxc4 Be6 Qa4 Bd5 Nc3 Ne4 Nxd5 cxd5 Bf4 Nc6 Rac1 Qb6 b3 Nxd4 Nxd4 Bxd4 e3 Bf6 Rfd1 Rac8 Qd7 Nc3 Kh1 Nxd1 Rxc8 Nxf2+ Kg1 Ng4 h3 e5 Re8 exf4 Rxf8+ Kxf8 Qxg4 Qxe3+ Kh1 fxg3 Qd1 d4 Bxb7 Kg7 Bg2 Qf2 a4 Qe3 Qf3 Qc1+ Qf1 Qc3 Qf3 d3 Bf1 g2+ Kxg2 Qb2+ Kh1 d2 Be2 Qc1+ Bd1 Qc5 Kg2 Qg5+ Qg3 Qe5 Qxe5 Bxe5 Kf3 f5 b4 Bc3 b5 Ba5 Ke3 Kf6 Kd4 g5 Kd5 Kg6 Ke5 h5 Ke6 g4 hxg4 fxg4 Ke5 Kg5 Ke4 h4 Ke3 h3 Kf2 Kf4 Kg1 Bb6+ Kh1 g3 a5 g2+ Kh2 g1=Q+ Kxh3 Qg3#,black,mate,D78,"Neo-Grünfeld Defense: Classical Variation, Original Defense",0 days 00:05:56.476000,59
9z9HYjqa,KarpenkoSergey,dimke1997,2479,2442,2020-12-03 00:41:15.731000+00:00,2020-12-03 00:46:52.439000+00:00,Nf3 Nf6 g3 g6 Bg2 Bg7 O-O O-O d3 d6 c4 Nc6 Nc3 h6 Rb1 a5 a3 e5 b4 axb4 axb4 Be6 Nd2 Qd7 b5 Nd8 e4 Bh3 f3 Bxg2 Kxg2 Ne6 Nb3 Qd8 Nd5 Nd7 Be3 c6 Nc3 f5 Bf2 fxe4 dxe4 Ndc5 Nxc5 dxc5 bxc6 bxc6 Qxd8 Raxd8 Rfd1 Nd4 Bxd4 cxd4 Na4 Rf6 Nc5 Bf8 Nd3 Re6 c5 Ra8 Rd2 Ra5 Rc1 Re8 Re2 Ra3 Rd2 Bg7 Re1 Rb8 f4 Rbb3 Nxe5 Bxe5 fxe5 d3 Kf3 Kf7 Ke3 Ke6 Red1 Kxe5 Rxd3 Rxd3+ Rxd3 Ra4 Rd6 Rxe4+ Kf3 Rc4 Rxg6 Rxc5 Rxh6 Rc3+ Kg4 c5 Rh8 c4 h4 Rc1 Rc8 c3 h5 c2 Kg5 Rg1 Rxc2 Rxg3+ Kh6 Kf6 Rf2+ Ke7 Kh7 Rg1 h6 Rg3 Rf4 Rg1 Rf2 Rg3 Kh8 Rg1 h7 Ke8 Rf4 Ke7 Re4+ Kf7 Rf4+ Ke7 Rf2 Rg3 Re2+ Kf7 Rf2+ Ke7 Rf4 Rg1,draw,draw,A05,King's Indian Attack: Symmetrical Defense,0 days 00:05:36.708000,70
HxX7yHaZ,dimke1997,Vitor_Oliveira,2448,2403,2020-12-01 18:53:39.646000+00:00,2020-12-01 18:57:40.182000+00:00,d4 b6 e4 Bb7 Bd3 e6 c4 Bb4+ Bd2 Bxd2+ Nxd2 Nh6 Ngf3 O-O Qc2 f5 O-O-O Nc6 a3 Na5 exf5 Nxf5 g4 Nh4 Bxh7+ Kh8 Ne5 d6 Ng6+ Nxg6 Bxg6 Bxh1 Rxh1 Rxf2 Qd3 Qh4 Ne4 Rxh2 Rxh2 Qxh2 Ng5 Qh6 Qe3 Qxg6,black,resign,A40,English Defense,0 days 00:04:00.536000,22
92kUTtXm,Ivanchucky1609,dimke1997,2463,2448,2020-12-01 18:47:05.470000+00:00,2020-12-01 18:53:34.717000+00:00,Nf3 Nf6 b3 g6 Bb2 Bg7 c4 O-O g3 d6 d4 Nbd7 Bg2 Re8 O-O c6 Nc3 e5 e4 exd4 Nxd4 Nc5 Re1 a5 Qd2 Qb6 Rad1 a4 Qc2 axb3 axb3 Bd7 h3 h5 Kh2 Na6 Na4 Qc7 Qd2 h4 Qg5 hxg3+ fxg3 Re5 Qf4 Nh5 Qf2 Rg5 g4 d5+ Kg1 Bxg4 hxg4 Rxg4 exd5 Nf4 d6 Qd7 Nb6 Qd8 Nxa8 Nxg2 Qxg2 Qg5 Re2 Rxg2+ Rxg2 Qe3+ Kf1 Nc5 Re2 Qh3+ Kg1 Nd3 Rxd3 Qxd3 d7 Bxd4+ Kf1 Bxb2 Nb6 Bf6 Kf2 Kg7 Re3 Qd2+ Re2 Qd4+ Kf3 Qxb6 Rd2 Qd8 Ke2 b5 Kd1 bxc4 bxc4 Qa5 Kc2 Qxd2+ Kxd2 Bd8 Kd3 Kf6 Ke4 Ke7 c5 Kxd7 Ke5 Ke7 Ke4 f5+ Kd4 Kf6 Kc4 g5 Kd4 g4 Ke3 g3 Kf3 Kg5 Kxg3 Bc7+ Kf3 f4 Kf2 Kf5 Ke2 Ke4 Kf2 f3 Kf1 Kf4 Ke1 Be5 Kf1 Bd4 Ke1 Bxc5 Kf1 Kg3 Ke1 f2+ Kf1 Bd4 Ke2 Kg2 Kd3 f1=Q+ Kxd4 Qf3 Kc5 Qf4 Kb6 Qf3 Kc5 Kg3 Kb6 Qe3+ Kc7 Kf4 Kd6 Qe4 Kc7,draw,outoftime,A05,Zukertort Opening: Nimzo-Larsen Variation,0 days 00:06:29.247000,82
wWErYt4l,dimke1997,Mariano_Nelson_II,2452,2588,2020-12-01 14:20:28.503000+00:00,2020-12-01 14:26:02.750000+00:00,d4 Nf6 Nf3 g6 c4 Bg7 g3 d6 Bg2 O-O O-O c6 Nc3 Qa5 e4 Bg4 h3 Bxf3 Bxf3 Nfd7 Be3 Na6 Rb1 c5 d5 Qb4 Be2 Rac8 a3 Qa5 Bd2 Qd8 Qc2 e5 Bd3 Nc7 b4 b6 Na4 Ne8 Nc3 Kh8 Nb5 Ra8 Be3 Ndf6 bxc5 dxc5 a4 Nd6 Nxd6 Qxd6 a5 Nd7 Rb3 bxa5 Ra1 f5 Rxa5 f4 Bc1 fxg3 fxg3 Qf6 Be3 Qf3 Bf2 Bh6 Bf1 Qf6 Rb7 Rf7 Raxa7 Rxa7 Rxa7 Be3 Bxe3 Qxf1+ Kh2 Qe1 Ra8+ Kg7 Ra7 Qxe3,black,resign,E62,"King's Indian Defense: Fianchetto Variation, Kavalek Defense",0 days 00:05:34.247000,42
8sWFRSrK,Mariano_Nelson_II,dimke1997,2584,2455,2020-12-01 14:15:48.698000+00:00,2020-12-01 14:20:22.741000+00:00,e4 c5 Ne2 Nc6 Nbc3 d6 g3 g6 Bg2 Bg7 d3 e6 O-O Nge7 Bg5 O-O Qd2 Rb8 a4 a6 Bh6 b5 Bxg7 Kxg7 axb5 axb5 d4 b4 Na4 cxd4 Nxd4 Nxd4 Qxd4+ e5 Qd2 Qc7 Rfd1 Rd8 c3 b3 Bf1 Be6 c4 Nc6 Qe3 Ra8 Nc3 Rxa1 Rxa1 Nd4 Nb5 Nxb5 cxb5 Qc2 Qe2 Rc8 b6 Qxe2 Bxe2 Rb8 Ra6 Bc8 b7 Bxb7 Rxd6 Bxe4 f3 Bf5 Bc4 Re8 g4 Be6 Bxe6 Rxe6 Rxe6 fxe6 g5 h6 h4 hxg5 hxg5 Kf7 Kf2 Ke7 Ke3 Kd6 Ke4 Kd7 Kxe5 Ke7 f4,white,resign,B23,"Sicilian Defense: Closed, Chameleon Variation",0 days 00:04:34.043000,45
fMfhX5Pr,dimke1997,Mariano_Nelson_II,2447,2592,2020-12-01 14:12:57.725000+00:00,2020-12-01 14:15:42.456000+00:00,d4 d5 c4 e6 Nc3 c6 e3 f5 Bd3 Nf6 Nge2 Bd6 f3 O-O Qc2 b6 Bd2 Ba6 cxd5 Nxd5 Nxd5 cxd5 Bxa6 Nxa6 O-O Rc8 Qb3 Nb4 Bxb4 Bxb4 Qxb4 Rc2 Rfe1 Qg5 Qb3 Rfc8 Rac1 R2c4 Qd3 h5 b3 R4c7 Rxc7 Rxc7 Rc1 Re7 Nf4 Kh7 Rc6 Qh4 g3 Qf6 Nxd5 Qf8 Nxe7 Qxe7 Qc4,white,resign,D31,Semi-Slav Defense: Accelerated Move Order,0 days 00:02:44.731000,28
rRcHPfQA,Rookdom,dimke1997,2475,2453,2020-12-01 01:21:25.450000+00:00,2020-12-01 01:26:59.884000+00:00,c4 g6 Nc3 Bg7 d4 Nf6 e4 d6 Be2 O-O Bg5 c5 d5 e6 Qd2 exd5 cxd5 Re8 f3 h6 Be3 a6 a4 Nbd7 Nh3 Nh7 O-O h5 Nf2 Rb8 h3 f5 exf5 gxf5 f4 h4 Bh5 Rf8 Be2 Ndf6 Nfd1 Re8 Bf2 Bd7 Bxh4 b5 axb5 axb5 Bf3 Qb6 Kh1 b4 Ne2 Bb5 Re1 Ne4 Bxe4 Rxe4 Ng3 Rxe1+ Qxe1 Re8 Qd2 Bd7 Ne3 Rf8 Be7 Rf7 Nc4 Qb7 Nxd6 Qc7 Nxf7 Kxf7 d6 Qc6 Qe2 Qd5 Ra7 Bc6 Bf8+ Kxf8 Qe7+ Kg8 Qxg7#,white,mate,E75,"King's Indian Defense: Averbakh Variation, Main Line",0 days 00:05:34.434000,42
wNR60RpN,Vinnare,dimke1997,2343,2448,2020-12-01 01:17:50.967000+00:00,2020-12-01 01:21:09.031000+00:00,d4 Nf6 c4 g6 Nf3 Bg7 Nc3 d6 e4 O-O Be2 e5 dxe5 dxe5 Bg5 Qxd1+ Rxd1 Bg4 O-O Nc6 Bxf6 Bxf6 Nd5 Bd8 Nd4 Nxd4 Bxg4 h5 Bf3 c6 Nc3 Be7 a3 Rfd8 Ne2 Nxf3+ gxf3 a5 f4 exf4 Nxf4 a4 f3 Bf6 Rxd8+ Rxd8 Rb1 Rd2 b3 Bd4+ Kh1 Be5 Ng2 axb3 f4 Bd4,black,resign,E92,King's Indian Defense: Exchange Variation,0 days 00:03:18.064000,28
OpZ4J4Xd,dimke1997,Sergei_Yudin01,2445,2319,2020-12-01 01:13:12.749000+00:00,2020-12-01 01:17:19.018000+00:00,d4 d5 c4 dxc4 Nf3 Nf6 e3 e6 Bxc4 a6 O-O c5 Nc3 Nc6 d5 Na5 Be2 exd5 b3 Be6 Bb2 Be7 Rc1 O-O Qc2 Rc8 Rfd1 Nc6 Qb1 b5 Qa1 Qb6 Ng5 Rfd8 Bf3 Ne5 Be2 h6 Nxe6 fxe6 Nxd5 exd5 Bxe5 Qe6 h3 c4 Bf3 Rd7 Qd4 Bc5 Qf4 Rf8 Qg3 d4 exd4 Bxd4 Bxd4 cxb3 axb3 Qxb3 Bxf6 Rxd1+ Rxd1 Rxf6 Bd5+,white,resign,D27,"Queen's Gambit Accepted: Classical Defense, Main Line",0 days 00:04:06.269000,32
8TVAoW3p,onitsha,dimke1997,2183,2443,2020-11-30 15:55:14.949000+00:00,2020-11-30 16:00:02.057000+00:00,Nf3 Nf6 c4 g6 g3 Bg7 Bg2 O-O d4 d6 Nc3 c6 O-O Bf5 Ne1 Be6 b3 d5 cxd5 cxd5 Nd3 Nc6 Nf4 Bf5 e3 Ne4 Nfxd5 Nxc3 Nxc3 Rc8 Bb2 Nb4 Rc1 Nd3 e4 Nxc1 exf5 Bxd4 Qxc1 Bxc3 Bxc3 Qd3 fxg6 hxg6 Bxb7 Rxc3 Qf4 Rd8 Be4 Qd4 h4 Rc5 Re1 Re5 h5 Rxh5 Bf3 Qxf4 gxf4 Rf5,black,resign,E62,"King's Indian Defense: Fianchetto Variation, Larsen Defense",0 days 00:04:47.108000,30
bZ2M23tf,dimke1997,Guzman70,2440,2174,2020-11-30 15:50:30.195000+00:00,2020-11-30 15:54:52.006000+00:00,d4 Nf6 Nf3 c5 d5 d6 Nc3 g6 e4 Bg7 Bb5+ Nbd7 a4 O-O O-O Ne8 Re1 Nc7 Bf1 Rb8 Bf4 f6 Qd2 a6 Rab1 b5 axb5 axb5 b4 c4 Nd4 Rb6 Be3 Ne5 Nc6 Rxc6 dxc6 Nxc6 Nd5 Ne6 Nc3 Ba6 Qd5 Qc8 Nxb5 Bxb5 Qxb5 Ne5 Qd5 Kh8 b5 Nc7 Qd2 f5 b6 Na6 b7 Qc6 exf5 gxf5 Rb6 Qa4 Bd4 Nb8 f4 Ned7 Rb4 Qc6 Bxg7+ Kxg7 Rxe7+ Kf6 Qe1 Nc5 Rxc4 Qb6 Kh1 Ne4 Rcxe4 fxe4 Qxe4 d5 Qe5+ Kg6 Qg5#,white,mate,A43,"Benoni Defense: Benoni-Indian Defense, Kingside Move Order",0 days 00:04:21.811000,42
GVwU6yPL,atlet123456,dimke1997,2240,2443,2020-11-30 15:44:27.652000+00:00,2020-11-30 15:50:09.067000+00:00,d4 Nf6 c4 g6 Nc3 Bg7 e4 d6 f4 c5 d5 O-O Nf3 e6 Be2 exd5 cxd5 a6 a4 Bg4 O-O Nbd7 h3 Bxf3 Bxf3 Ne8 Be3 Nc7 Qd2 Rb8 f5 b5 axb5 axb5 Bh6 Bd4+ Kh1 Re8 fxg6 hxg6 Bg4 Ne5 Bf3 Nc4 Qc1 Nxb2 Qxb2 b4 Qc1 Bxc3 Rb1 Nb5 Qf4 Be5 Qg4 Nc3 Rb3 c4 Rb2 Nxd5 exd5 Bxb2 Be4 Rxe4 Qxe4 Be5 h4 Kh7 Rxf7+ Kh8 Qxg6 Qg8 Qh5 Qxf7 Qxf7 b3 Bg5 Rg8 Qh5+ Kg7 Qh6+ Kf7 Qh7+ Rg7 Qh5+ Kf8 Qh8+ Rg8 Qh6+ Rg7 Qh8+ Kf7 Qh5+ Kg8 Qe8+ Kh7 Qh5+ Kg8 Qe8+ Kh7 Qh5+ Kg8,draw,draw,E77,"King's Indian Defense: Four Pawns Attack, Normal Attack",0 days 00:05:41.415000,51
2fGurEoR,dimke1997,PozharskyNikolay,2441,2191,2020-11-30 15:41:43.840000+00:00,2020-11-30 15:43:43.308000+00:00,d4 d5 c4 e6 Nc3 Nf6 cxd5 exd5 Bg5 Be7 e3 b6 Bd3 h6 Bh4 Nbd7 Nf3 Bb7 O-O O-O Rb1 c5 Qc2 c4 Bf5 Rc8 Rbd1 a6 Ne5 b5 Bxf6 Nxf6 Bxc8 Qxc8 a3 Bd6 f4 Ng4 Qe2 f6 Nxg4,white,resign,D35,"Queen's Gambit Declined: Exchange Variation, Positional Variation",0 days 00:01:59.468000,20
DuxWpVEd,idayriyadi,dimke1997,2120,2440,2020-11-30 15:40:49.689000+00:00,2020-11-30 15:40:49.689000+00:00,,black,noStart,unknown,unknown,0 days 00:00:00,0
BbfsmEOH,dimke1997,torllok,2438,2071,2020-11-30 15:37:31.241000+00:00,2020-11-30 15:40:33.694000+00:00,d4 d5 c4 c6 Nc3 Nf6 e3 e6 Nf3 Be7 b3 O-O Bd3 b6 O-O Bb7 Qc2 Nbd7 Bb2 h6 Rad1 Rc8 Ne5 Nxe5 dxe5 Nd7 f4 Bc5 Qe2 d4 Ne4 dxe3 Nxc5 bxc5 Qxe3 Qe7 Qe4 g6 Bc2 Rfd8 Rd6 Nb6 Rfd1 Rxd6 exd6 Qf8 Qe5 Kh7 h4 Rd8 h5 Nd7 hxg6+ fxg6 Qxe6 Bc8 Qxg6#,white,mate,D45,Semi-Slav Defense: Main Line,0 days 00:03:02.453000,28
criwOZVQ,dimke1997,przemkowski,2438,1858,2020-11-30 15:34:47.331000+00:00,2020-11-30 15:36:56.245000+00:00,d4 e6 c4 d5 Nc3 Nf6 cxd5 exd5 Bg5 c6 e3 Bd6 Bd3 O-O Qc2 h6 Bh4 Nbd7 Nf3 Qe7 O-O-O Qe8 Kb1 a5 Rhe1 b5 e4 Bc7 exd5 Qd8 dxc6 Nb8 Ne4 Bg4 Nxf6+ gxf6 Bf5 Bh5 g4,white,resign,D35,"Queen's Gambit Declined: Exchange Variation, Positional Variation",0 days 00:02:08.914000,19
ZHIbAhBS,africanboy,dimke1997,1831,2437,2020-11-30 15:30:08.230000+00:00,2020-11-30 15:34:28.156000+00:00,d4 Nf6 Nf3 g6 Bf4 d6 e3 Bg7 c4 O-O Nbd2 b6 Rc1 Bb7 b3 Nbd7 Bd3 Re8 Qe2 e5 dxe5 dxe5 Bg5 e4 Bxf6 Nxf6 Nxe4 Nxe4 O-O Nc3 Qc2 Ne4 Nd4 Qg5 f3 Qxe3+ Kh1 Qxd4 fxe4 Bxe4 Rcd1 Bxd3 Rxd3 Qe4 Rfd1 h5 Qd2 h4 h3 Be5 Re3 Qf4 Rxe5 Qxe5 Qd7 Rad8 Qxd8 Rxd8 Rxd8+ Kg7 Rd1 Qe2 Ra1 Qb2 Rd1 Qxa2 Rd7 Qxb3 Rxc7 a5 c5 bxc5 Rxc5 a4 Kh2 a3 g3 a2 Ra5 Qc2+ Kg1 Qd1+ Kg2 Qd2+ Kf3 Qxa5 gxh4 a1=Q h5 Qf5+ Kg3 Qc3+ Kh2 Qfc2+ Kg1 Qa1#,black,mate,A48,London System,0 days 00:04:19.926000,48
Ox99vwxg,dimke1997,MisterPinte,2437,1776,2020-11-30 15:24:16.300000+00:00,2020-11-30 15:29:40.227000+00:00,d4 e6 c4 Bb4+ Bd2 Qe7 e4 b6 Bd3 Bb7 Nf3 Nf6 Qc2 Bxd2+ Nbxd2 d6 O-O e5 d5 Bc8 b4 Nbd7 Nb3 g6 Rac1 Nh5 c5 bxc5 bxc5 Nf4 Bb5 O-O cxd6 cxd6 Na5 Nc5 Nb3 a6 Nxc5 axb5 Nd3 Nxd3 Qxd3 Qb7 Rc6 Rxa2 Rxd6 b4 Nxe5 b3 Nc4 b2 Rb6 Qa7 Rxb2 Rxb2 Nxb2 Qa2 Qd2 Bd7 Rc1 Rb8 Nc4 Qa7 Ne5 Be8 Ng4 Qd7 Nf6+,white,resign,A40,Kangaroo Defense,0 days 00:05:23.927000,34
MNYLSs7r,dimke1997,Grosir_Granat-BKD,2445,2288,2020-11-30 15:23:24.263000+00:00,2020-11-30 15:23:24.263000+00:00,,black,noStart,unknown,unknown,0 days 00:00:00,0
EP4c9qaQ,langsam1967,dimke1997,2310,2447,2020-11-30 15:16:57.067000+00:00,2020-11-30 15:22:39.640000+00:00,f4 c5 Nf3 d5 g3 g6 Bg2 Bg7 O-O Nf6 c4 O-O cxd5 Nxd5 Nc3 Nc7 b3 Nc6 Bb2 Rb8 Qc1 b6 d3 Bb7 Ne4 Nd4 Nxd4 cxd4 Qd2 Nd5 Rfc1 Qd7 Bf3 Rfc8 Rxc8+ Rxc8 Rc1 Nc3 Kf1 Bxe4 dxe4 b5 Bxc3 Qh3+ Bg2 Qxh2 Bb2 Rxc1+ Qxc1 Qxg3 Qc8+ Bf8 Bxd4 Qxf4+ Bf3 h5 Bc5 Qc1+ Kg2 h4 b4 Qg5+ Qg4 Qf6 Kh3 e6 Bxf8 Kxf8 Qxh4 Qb2 Qd8+ Kg7 Qd6 Qxa2 Qd4+ Kg8 e5 a6 Kg4 Kg7 Qf4 Qc2 Qf6+ Kg8 Kg5 Qd2+ Kg4 Qd4+ Qf4 Qg1+ Qg3 Qd4+ Qf4 Qg1+ Kh3 Qf1+ Kh2 Qf2+ Kh3 Qf1+ Kg4 Qg1+,draw,draw,A02,Bird Opening,0 days 00:05:42.573000,51
riB51t8c,Simon2049,dimke1997,2402,2442,2020-11-30 15:05:12.217000+00:00,2020-11-30 15:10:24.261000+00:00,d4 Nf6 c4 g6 Nc3 Bg7 e4 d6 Nf3 O-O Be2 e5 d5 a5 Bg5 h6 Be3 Ng4 Bd2 f5 h3 Nf6 exf5 gxf5 Qc1 f4 g3 e4 Nh4 e3 fxe3 fxg3 Ng6 Re8 Nf4 Na6 Rg1 Nc5 Rxg3 Nfe4 Rg2 Qh4+ Kf1 Bxh3 Nxh3 Qxh3 Bg4 Rf8+ Kg1 Qh4 Be1 Qe7 Nxe4 Nxe4 Be6+ Kh8 Qc2 Ng5 Bg4 Qxe3+ Bf2 Qe4 Qd2 Qxg4 Rxg4 Nf3+ Kg2 Nxd2 Rh1 Nf3 Be3 Ne5 Rxg7 Kxg7 Bxh6+ Kg6 Bxf8 Rxf8,black,resign,E92,"King's Indian Defense: Petrosian Variation, Stein Defense",0 days 00:05:12.044000,39
khMjOCVd,dimke1997,Dgita35492,2438,2357,2020-11-30 14:57:21.725000+00:00,2020-11-30 15:03:17.957000+00:00,d4 Nf6 Nf3 g6 c4 Bg7 g3 O-O Bg2 d5 cxd5 Nxd5 O-O c5 e4 Nb6 d5 e6 Nc3 exd5 exd5 Bg4 h3 Bxf3 Qxf3 Na6 Rd1 Nc4 d6 Nxd6 Nb5 Nxb5 Rxd8 Raxd8 Be3 Nd6 Rd1 b6 Bg5 f6 Bf4 Nf5 a3 Nd4 Qb7 Ne2+ Kh2 Rxd1 Qxa6 Nxf4 gxf4 Rd7 f5 gxf5 Qc4+ Kh8 Qe6 Rd2 Qxf5 Bh6 Be4 Rf7 Bd5 Rf8 Kg2 Be3 Kg3 Rxf2 Qe6 Bd4 h4 Rxb2 h5 h6 Be4 Re2 Qf5 Rg8+ Kh3 Re3+ Kh4 Rxe4+ Qxe4 Be5 Qe3 Rg5 Qd3 Kg7 Qd7+ Kf8 Qxa7 f5 Qxb6 Bg3+ Kh3 f4 Qxh6+ Rg7 Qf6+ Kg8 h6 Rf7 Qg6+ Kf8 h7 f3 h8=Q+ Ke7 Qxf7+ Kxf7 Kxg3,white,outoftime,D74,Neo-Grünfeld Defense: Delayed Exchange Variation,0 days 00:05:56.232000,55
89Ysboeo,Dgita35492,dimke1997,2361,2433,2020-11-30 14:52:31.625000+00:00,2020-11-30 14:56:52.657000+00:00,g3 g6 Bg2 Bg7 e4 d6 Ne2 c5 d4 cxd4 Nxd4 Nc6 Be3 Nf6 h3 O-O O-O Nxd4 Bxd4 e5 Be3 Be6 Nc3 a6 Qd2 Qc7 Bh6 Rfd8 Bxg7 Kxg7 Rfd1 Rac8 Rac1 b5 a3 Qb6 Kh2 a5 f4 b4 axb4 axb4 Ne2 d5 exd5 Nxd5 f5 Ne3 fxe6 Rxd2 Rxd2 Nxg2 Kxg2 Qxe6 Ng1 Qc6+ Nf3 Qb7 Re1 e4,black,resign,A00,Hungarian Opening: Symmetrical Variation,0 days 00:04:21.032000,30
yeYcE3Xz,Fatherofchess-111,dimke1997,2162,2442,2020-11-30 12:36:52.682000+00:00,2020-11-30 12:42:08.737000+00:00,cxd5 c4 Nf6 Nc3 Nc6 Nf3 Be6 Bg5 g6 Bxf6 exf6 cxd5 Bxd5 Bb5 Be7 Bxc6+ bxc6 O-O O-O Re1 Bb4 a3 Bxc3 bxc3 Qa5 Qd3 Qa4 Nd2 Be6 h4 Rab8 h5 Bf5 Qf3 Rb2 Ne4 Bxe4 Rxe4 f5 h6 Qc2 Re7 Rb3 Rf1 Rxc3 Qf4 Qb3 Qe5 f6 Rg7+ Kh8 Qe7 Qg8 Rxg8+,white,resign,unknown,unknown,0 days 00:05:16.055000,27
22SsDFUi,dimke1997,AlekhinDz031,2442,1859,2020-11-30 12:35:27.810000+00:00,2020-11-30 12:36:40.956000+00:00,cxd5 c4 dxc4 Bxc4 e6 Nf3 Nf6 O-O Be7 Nc3 O-O Re1 b6 d5 exd5 Nxd5 Nxd5 Bxd5 Nc6 Bxc6,white,resign,unknown,unknown,0 days 00:01:13.146000,10
4XStOLp9,dimke1997,chessas2004,2448,2400,2020-11-30 12:26:14.553000+00:00,2020-11-30 12:31:40.444000+00:00,d4 d5 c4 e6 Nc3 Nf6 cxd5 exd5 Bg5 Nbd7 e3 c6 Bd3 Bd6 Qc2 O-O Nf3 h6 Bh4 Re8 O-O-O b5 Kb1 a5 h3 a4 g4 g5 Nxg5 hxg5 Bxg5 Qa5 Ne2 Bb7 Bf5 b4 Bxd7 Nxd7 Qf5 Re6 Nf4 Bxf4 Bxf4 a3 b3 c5 Qg5+ Kf8 h4 c4 h5 Nf6 h6 cxb3 h7 bxa2+ Ka1 Ke7 Be5 b3 Bxf6+ Kd7 h8=Q Qc3#,black,mate,D35,"Queen's Gambit Declined: Exchange Variation, Positional Variation",0 days 00:05:25.891000,32
szyru4uN,dimke1997,randy_segarra,2454,2493,2020-11-30 12:21:52.757000+00:00,2020-11-30 12:25:04.643000+00:00,d4 Nf6 Nf3 g6 c4 Bg7 g3 O-O Bg2 c6 O-O d5 Qb3 dxc4 Qxc4 Be6 Qa4 Nbd7 Nc3 Nb6 Qc2 Nfd5 e4 Nb4 Qe2 Bc4 Qe1 Nc2 Qd1 Nxa1 Re1 e5 Bg5 f6 Be3 exd4 Bxd4 c5 Bxc5 Qxd1 Rxd1 Nc2 Rc1 Bd3 Bxf8 Bxf8 a3 Rc8 Bf1 Bxf1 Kxf1 Nxa3 bxa3 Bxa3 Rc2 Bb4,black,resign,D78,"Neo-Grünfeld Defense: Classical Variation, Original Defense",0 days 00:03:11.886000,28
anxjBa4V,vvchessli,dimke1997,2574,2446,2020-11-30 04:56:49.108000+00:00,2020-11-30 05:02:34.483000+00:00,Nc3 c6 d4 d5 Bf4 Bf5 e3 e6 f3 Nf6 g4 Bg6 h4 h6 Bd3 Bxd3 Qxd3 Qb6 O-O-O Bb4 Nge2 Qa6 Qxa6 Nxa6 a3 Ba5 Ng3 Bc7 Bxc7 Nxc7 e4 a6 e5 Nd7 f4 f6 Rde1 fxe5 fxe5 O-O Rhf1 c5 Nce2 Rxf1 Nxf1 Rf8 c3 Rf2 Nfg3 Nb5 Rf1 Rxf1+ Nxf1 cxd4 cxd4 Nb8 Kd2 Nc6 Kd3 g5 hxg5 hxg5 Nd2 Kf7 Nf3 Kg6 Neg1 Na5 Nh3 Nc4 Nhxg5 Nxb2+ Kc2 Nc4 Nxe6 Nbxa3+ Kd3 b5 Nf4+ Kf7 Nxd5 Nb2+ Ke4 Nd1 Kf5 Ne3+ Nxe3 b4 e6+ Ke8 d5 Nc4 d6 Nxe3+ Kf6 Nd5+ Kg7 b3 Ne5 b2 Nc6 Nb6,black,outoftime,A00,Van Geet Opening,0 days 00:05:45.375000,51
EsABKscY,dimke1997,vvchessli,2450,2570,2020-11-30 04:54:41.099000+00:00,2020-11-30 04:56:26.496000+00:00,d4 d5 c4 dxc4 Nf3 c5 e3 cxd4 Bxc4 Nf6 O-O e6 exd4 Be7 Qe2 O-O Nc3 a6 Rd1 b5 Bb3 Bb7 Bg5 Nbd7 Rac1 h6 Bh4 Nb6 Ne5 Nfd5 Bxe7 Qxe7 Ne4 Rac8 Nc5 Ba8 Bc2 Qg5 Nf3 Nf4,black,resign,D26,"Queen's Gambit Accepted: Classical Defense, Steinitz Variation, Exchange Variation",0 days 00:01:45.397000,20
00l8Wa8y,vvchessli,dimke1997,2572,2448,2020-11-30 04:50:14.692000+00:00,2020-11-30 04:54:35.249000+00:00,Nc3 c5 Nf3 Nc6 d4 cxd4 Nxd4 Nf6 g3 g6 Bg2 Bg7 O-O O-O Nxc6 bxc6 b3 Nd5 Nxd5 Bxa1 Ba3 cxd5 Bxd5 Rb8 Qxa1 Bb7 Bxb7 Rxb7 Qd4 d6 Bb2 e5 Qd5 Qc7 c4 a5 Rd1 a4 Qxd6 Qxd6 Rxd6 axb3 axb3 Rxb3 Bxe5 Re8 Bf6 Rbb8 e3 Re6 Rxe6 fxe6 c5 Kf7 Be5 Rb1+ Kg2 Rc1 Bd6 Kf6 f4 Rc2+ Kf3 Rxh2 c6 Rc2 c7 h5 e4 Kf7 Be5 Ke7 Ke3 Kd7 Kf3 Rc5 g4 Rxe5 fxe5 h4 g5 Kxc7 Kg4 Kc6 Kxh4 Kc5 Kg4 Kd4 Kf4 Kd3 Kf3 Kd4 Kf4 Kd3 Kf3 Kd4 Kf4 Kd3 Kf3,draw,draw,A00,Van Geet Opening: Sicilian Two Knights,0 days 00:04:20.557000,49
dLYiWI4Z,dimke1997,mishabmstu,2443,2334,2020-11-30 04:44:39.219000+00:00,2020-11-30 04:48:13.212000+00:00,d4 Nf6 Nf3 g6 c4 Bg7 g3 d5 cxd5 Nxd5 Bg2 O-O O-O c5 e4 Nb4 a3 N4a6 d5 b6 Nc3 e5 Nd2 Nc7 a4 Ne8 Nc4 Nd6 Nxd6 Qxd6 Nb5 Qd8 d6 Ba6 Qd5 Bxb5 axb5 Nd7 Be3 Re8 h3 Re6 h4 Bf8 Rfd1 Rxd6 Qb7 Rb8 Qxa7 Nf6 Bf3 Rd4 Bxd4 cxd4 Rac1 Bc5 b4 Bxb4 Rc7 Qf8 Rxf7 Qxf7 Qxb8+ Kg7 Qxb6 Qd5 exd5 Ng4 Bxg4 Be1 Rxe1,white,resign,D74,Neo-Grünfeld Defense: Delayed Exchange Variation,0 days 00:03:33.993000,35
IPBJVE50,Lean98,dimke1997,2391,2438,2020-11-30 04:42:15.509000+00:00,2020-11-30 04:44:27.420000+00:00,e4 c5 Nf3 Nc6 d4 cxd4 Nxd4 Nf6 Nc3 d6 Bc4 e6 Bb3 Be7 Be3 Bd7 f3 O-O g4 Nxd4 Qxd4 Bc6 O-O-O b5 h4 a5 a3 b4 axb4 axb4 Na2 d5 e5 Nd7 Kb1 Bc5 Qd2 Bxe3 Qxe3 Qa5 Qd4 Nc5 Qxb4 Nxb3 cxb3 Qxa2+,black,resign,B88,"Sicilian Defense: Sozin Attack, Leonhardt Variation",0 days 00:02:11.911000,23
IZcQx0xn,dimke1997,Luckyman820,2446,2329,2020-11-30 03:31:42.993000+00:00,2020-11-30 03:37:55.110000+00:00,d4 f5 Nf3 Nf6 g3 d6 Bg2 g6 O-O Bg7 c4 O-O Nc3 c6 Rb1 Ne4 Nxe4 fxe4 Ne1 d5 b4 Bf5 Nc2 Qd7 Ne3 h5 b5 dxc4 Nxf5 gxf5 e3 e5 Qxh5 exd4 exd4 cxb5 Ba3 Rf7 Rfd1 a5 Bc5 b4 d5 Na6 Bd4 c3 Rbc1 a4 Bh3 Bxd4 Rxd4 Rc8 Qg6+ Rg7 Qxf5 Qxf5 Bxf5 Rc5 Be6+ Kf8 d6 Ke8 d7+ Kd8 f3 exf3 Rf4 Ke7 Rf8 Rd5 Bxd5 Kxd7 Rf7+ Rxf7 Bxf7 Kd6 Kf2 Nc5 h4 Nd3+ Kxf3 Nxc1 h5 Ke7 Bg6 b3 h6 Kf6 Be4 bxa2 g4 a1=Q g5+ Kxg5 h7 c2 h8=Q Qxh8 Kf2 Qf6+ Ke3 Qf4+ Kd4 Qxe4+ Kc3 a3 Kd2 Nb3+ Kc3 c1=Q+ Kxb3 Qec4#,black,mate,A88,"Dutch Defense: Leningrad Variation, Warsaw Variation",0 days 00:06:12.117000,56
