game_id,white_player,black_player,white_elo,black_elo,game_started_at,game_ended_at,moves,winner,status,eco,name_of_opening,game_duration,num_of_moves
Db8NY5Z2,dimke1997,KoumissLover,2500,2438,2021-07-22 12:38:56.404000+00:00,2021-07-22 12:42:33.539000+00:00,e4 e6 d3 d5 Qe2 Be7 Nf3 Nf6 g3 O-O Bg2 c5 O-O Nc6 e5 Nd7 h4 h6 c4 dxc4 dxc4 Qc7 Bf4 Rd8 Nc3 a6 h5 Nd4 Nxd4 cxd4 Nd5 exd5 cxd5 Qb6 d6 Bg5 Bxg5 hxg5 f4 d3+ Qf2 gxf4 gxf4 Qxf2+ Rxf2 Nc5 b4 Na4 Be4 Bg4 Bxd3 Rac8 Rg2 Rc3 Be4 Bf3 Bxf3 Rxf3 Rf1 Rxf1+ Kxf1 Kf8 Rc2 Nb6 Rc5 Rc8 Rxc8+ Nxc8 d7,white,resign,C00,French Defense: King's Indian Attack,0 days 00:03:37.135000,34
wmYHobbs,KoumissLover,dimke1997,2444,2494,2021-07-22 12:34:44.359000+00:00,2021-07-22 12:38:49.142000+00:00,d4 Nf6 c4 g6 Nc3 Bg7 e4 d6 Bd3 O-O Nge2 Nc6 O-O Nd7 Be3 e5 d5 Nd4 Bc2 Nxc2 Qxc2 f5 f3 f4 Bf2 g5 h3 a6 b4 h5 c5 Nf6 b5 g4 fxg4 hxg4 hxg4 Nxg4 cxd6 cxd6 a4 Qe8 Qd3 Qh5 Qh3 Qg6 Qf3 Bd7 Bb6 Bh6 Bc7 Kh8 b6 Rg8 a5 Ne3 g3 Nxf1 Rxf1 Bg4 Qf2 fxg3 Qf7 Bh3 Qxg6 Be3+,black,resign,E70,King's Indian Defense: Normal Variation,0 days 00:04:04.783000,33
x7vXKajK,dimke1997,MaxFu,2502,2429,2021-07-22 04:41:04.510000+00:00,2021-07-22 04:47:14.483000+00:00,d4 Nf6 Nf3 d5 c4 e6 Nc3 Bb4 Qa4+ Nc6 a3 Bxc3+ bxc3 O-O Bg5 h6 Bxf6 Qxf6 e3 dxc4 Bxc4 Bd7 Qc2 e5 O-O Bg4 Bd5 exd4 cxd4 Ne7 Be4 c6 Ne5 Be6 Rab1 Rab8 a4 Rfd8 f4 Bf5 a5 Bxe4 Qxe4 Nd5 Rb3 Qe7 Qb1 Qc7 Rc1 f6 Nc4 Re8 g3 Qe7 Re1 c5 e4 cxd4 Kf2 Nc3 Qd3 Nxe4+ Kg2 f5 Rb5 a6 Rxf5 Nc5 Rxe7 Nxd3 Rxe8+ Rxe8 Rd5 Ne1+ Kh3 Nc2 Ne5 Rc8 Rd8+ Rxd8 Nd3 Nb4 Nxb4 d3 Kg4 d2 Kf5 d1=Q Nd5 Qd3+ Kg4 Rxd5 Kh3 h5 Kh4 Qg6 h3 Qf6#,black,mate,D38,"Queen's Gambit Declined: Ragozin Defense, Alekhine Variation",0 days 00:06:09.973000,49
AxU4iU6o,dimke1997,ftower,2507,2530,2021-07-20 22:34:55.025000+00:00,2021-07-20 22:36:38.714000+00:00,d4 Nf6 Nf3 b6 c4 Bb7 Nc3 e6 a3 g6 Qc2 d5 cxd5 Nxd5 e4 Nxc3 bxc3 Bg7 Bb5+ c6 Bd3 O-O O-O c5 Bb2 Nc6 Rfd1 Rc8 Qe2 cxd4 cxd4 Nxd4 Bxd4 Bxd4 Ba6 Bxa6 Qxa6 Bxa1 Rxd8 Rc1+,black,resign,E12,"Queen's Indian Defense: Kasparov-Petrosian Variation, Hedgehog Variation",0 days 00:01:43.689000,20
yKEujg5R,Carpe7diem,dimke1997,2461,2515,2021-07-20 18:36:14.936000+00:00,2021-07-20 18:41:00.902000+00:00,e4 c5 Nf3 Nc6 d4 cxd4 Nxd4 Nf6 Nxc6 bxc6 Bd3 g6 Bg5 Bg7 O-O d6 Nc3 O-O Qd2 Rb8 b3 Ng4 h3 Ne5 Bh6 Nxd3 cxd3 c5 Bxg7 Kxg7 d4 Ba6 Rfe1 Qa5 e5 d5 dxc5 e6 Ne4 Qxd2 Nxd2 Rfe8 Rec1 Rec8 a3 Be2 b4 a5 Rab1 Rb5 Nb3 axb4 Nd4 Rbxc5 Rxc5 Rxc5 axb4,white,resign,B33,Sicilian Defense: Open,0 days 00:04:45.966000,28
huFJiFp9,wang5ter,dimke1997,2479,2522,2021-07-20 08:07:24.789000+00:00,2021-07-20 08:13:41.804000+00:00,d4 Nf6 c4 g6 g3 Bg7 Bg2 O-O Nc3 d6 Nf3 c6 e4 Qb6 O-O Bg4 h3 Bxf3 Bxf3 Nfd7 d5 Na6 Rb1 Rfc8 Be3 Qd8 Bd4 Bxd4 Qxd4 Qb6 Qd2 Ne5 Be2 cxd5 Nxd5 Qd8 b3 e6 Ne3 Qe7 f4 Nc6 f5 Rd8 Ng4 Nc5 Nh6+ Kh8 fxg6 fxg6 Nf7+ Kg7 Qh6+ Kg8 Nxd8 Rxd8 Bg4 Ne5 Rbe1 a5 Bd1 b6 h4 Rc8 h5 g5 Rf6 Nf7 Rxf7 Qxf7 Qxg5+ Kh8 Rf1 Qg7 Qe3 Rg8 Kh2 Qe5 Rf4 d5 cxd5 exd5 Rf5 Qb2+ Kh3 Nxe4 Bg4 Nf2+ Rxf2 Qg7 Rf4 d4 Qxd4 h6 Qxg7+ Kxg7 Re4 Rb8 Rd4 Kf6 Rd7 Ke5 Re7+ Kd4 Re6 Kc3 Rxh6 Kb2 Rc6 Kxa2 Rd6 Kxb3 Rd2 a4 Rd3+ Kb2 Rd2+ Kc3 Rd3+ Kxd3 Bf5+ Kc3 Be6 a3 Bd5,white,outoftime,E60,"Indian Defense: King's Indian Variation, Fianchetto Variation",0 days 00:06:17.015000,62
zVPeBqTk,dimke1997,Hidroksipropil,2528,2545,2021-07-20 00:04:37.114000+00:00,2021-07-20 00:06:02.359000+00:00,d4 d5 c4 c6 Nc3 Nf6 e3 a6 Qc2 b5 b3 Bg4 Nge2 Nbd7 Ng3 e5 dxe5 Nxe5 cxd5 cxd5 Be2 Bxe2 Ncxe2 Rc8 Qd2 Bb4,black,resign,D10,Slav Defense,0 days 00:01:25.245000,13
uk8MG8Hk,dimke1997,BLITZ16,2522,2462,2021-07-20 00:01:21.668000+00:00,2021-07-20 00:04:24.370000+00:00,d4 Nf6 Nf3 d5 c4 c6 e3 e6 Nc3 Bb4 Bd3 dxc4 Bxc4 O-O O-O Nbd7 Qe2 Re8 Rd1 Qe7 e4 b5 Bb3 a5 e5 Nd5 Nxd5 cxd5 Bg5 f6 exf6 gxf6 Bh4 a4 Bc2 Rb8 a3 Bd6 Re1 Nf8 Ne5 Qg7 Ng4 Ng6 Nxf6+ Kh8,white,resign,D45,Semi-Slav Defense: Main Line,0 days 00:03:02.702000,23
z0AZjLdD,BLITZ16,dimke1997,2467,2516,2021-07-19 23:54:59.214000+00:00,2021-07-20 00:01:17.940000+00:00,e4 c5 Nf3 Nc6 Bb5 Nf6 Nc3 Qc7 O-O Nd4 Bc4 e6 d3 a6 Nxd4 cxd4 Ne2 Nxe4 Bxe6 dxe6 dxe4 e5 f4 Bc5 Kh1 O-O fxe5 Qxe5 Qd3 Be6 Bf4 Qh5 Nxd4 Rad8 c3 b5 b3 b4 Rad1 Bg4 Rd2 a5 h3 bxc3 Qxc3 Bb4 Qc4 Bxd2 Bxd2 Be2 Nxe2 Rxd2 Ng3 Qg5 Rf3 h5 Qc3 h4 Rf5 Rd1+ Rf1 Rfd8 Qf3 Rxf1+ Nxf1 Rc8 Kh2 Rc1 Ne3 Qe5+ g3 Qxg3+ Qxg3 hxg3+ Kxg3 Rc3 Kf4 f6 Nd5 Rxh3 Nc7 a4 b4 a3 b5 Rh2 b6 Rxa2 Nb5 Rb2 Nxa3 Rxb6 Nc4 Rb4 Ne3 Kf7 Nd5 Rd4 Ke3 Ra4 Nb6 Ra3+ Kf4 Ke6 Nd5 g5+ Kg4 Ke5 Ne7 Ra4 Ng6+ Ke6 Kh3 Rxe4 Nf8+ Ke7 Ng6+ Kf7 Nh8+ Kg7 Kg3 Kxh8 Kf3 f5 Kf2 Kg7 Kf3 Kf6 Kf2 g4 Kg2 Kg5 Kf2 Rf4+ Kg2 Ra4 Kg3 Ra3+ Kg2 f4 Kf2 Ra2+ Ke1 g3 Kd1 g2 Ke1 g1=Q#,black,mate,B30,Sicilian Defense: Nyezhmetdinov-Rossolimo Attack,0 days 00:06:18.726000,74
pCzBsOI3,vrbas2005,dimke1997,2450,2510,2021-07-19 16:42:52.587000+00:00,2021-07-19 16:45:54.366000+00:00,d4 Nf6 Bf4 d6 e3 g6 Nf3 Bg7 h3 O-O Bg3 b6 Be2 Bb7 O-O Nbd7 a4 a6 c3 Ne4 Bh2 e5 Nbd2 f5 Qb3+ Kh8 Nxe4 Bxe4 Nd2 Bb7 Bf3 e4 Be2 g5 c4 f4 Qc2 f3 gxf3 exf3 Bd3 g4 Bg3 h5 h4 Bf6 Bg6 Bxh4 Bxh5 Bxg3 fxg3 Qg5 Qg6 f2+ Rxf2 Qxe3 Nf3 Rxf3 Rf1 Rxg3+ Kh2 Rh3+ Kg1 Qg3+,black,resign,A45,Indian Defense,0 days 00:03:01.779000,32
sGhzCOG3,dimke1997,vrbas2005,2504,2455,2021-07-19 16:37:00.875000+00:00,2021-07-19 16:42:50.267000+00:00,d4 d5 c4 c6 Nc3 Nf6 e3 g6 Nf3 Bg7 Be2 O-O O-O dxc4 Bxc4 Bg4 h3 Bxf3 Qxf3 Nbd7 Rd1 e5 dxe5 Nxe5 Qe2 Qe7 Bb3 Rfd8 Bd2 Rd7 e4 Rad8 Bg5 h6 Be3 b6 Rxd7 Rxd7 Rd1 Rxd1+ Qxd1 Qd7 Qxd7 Nfxd7 Bc2 Nc4 Bc1 b5 Kf1 b4 Na4 Ndb6 Nxb6 axb6 b3 Na3 Bd3 Kf8 Ke2 Ke7 f4 Bd4 Be3 Bxe3 Kxe3 f6 e5 g5 exf6+ Kxf6 fxg5+ hxg5 Ke4 Ke6 g3 Kf6 Kd4 Ke6 h4 gxh4 gxh4 Kf6 Ke3 Kg7 Kf4 Kh6 Ke5 Kh5 Kd6 Kxh4 Kxc6 b5 Kb6 Kg4 Kc5 Kf4 Kxb4 Ke3 Kxa3 Kxd3 Kb4 Kd4 Kxb5 Kd5 a4 Kd6 Kb6 Kd7 Kb7 Kd6 a5 Kc5 a6 Kb4 a7 Kxb3 a8=Q Kc3 Qh8+ Kd3 Qh4 Ke3 Qg4 Kf2 Qh3,white,resign,D10,Slav Defense,0 days 00:05:49.392000,62
dclN0Yuw,VasilijeVladacki,dimke1997,2546,2511,2021-07-19 00:06:43.317000+00:00,2021-07-19 00:12:28.015000+00:00,e4 c5 Nf3 Nc6 d4 cxd4 Nxd4 Nf6 Nc3 d6 Bg5 Qa5 Bxf6 gxf6 Nb3 Qg5 Nd5 Rb8 f4 Qh6 g3 Bg7 Nc7+ Kf8 Qd2 f5 e5 dxe5 O-O-O Be6 Bg2 e4 Nc5 Rc8 g4 Bxb2+ Kxb2 Rxc7 g5 Qg7+ c3 Rc8 h4 b6 Nd7+ Ke8 h5 Na5 Ne5 Qxe5 fxe5 Nc4+ Ka1 Nxd2 Rxd2 Rg8 Bf1 Rxg5 Bb5+ Kf8 h6 e3 Rd3 f4 Rhd1 f6 Rd8+ Rxd8 Rxd8+ Kf7 Be8+ Kf8 Bg6#,white,mate,B60,Sicilian Defense: Richter-Rauzer Variation,0 days 00:05:44.698000,36
zX7P9LK9,dimke1997,VasilijeVladacki,2502,2553,2021-07-19 00:00:59.384000+00:00,2021-07-19 00:06:39.776000+00:00,e4 c5 Nf3 d6 d4 cxd4 Nxd4 Nf6 Nc3 a6 Be2 e5 Nb3 Be7 g4 b5 g5 Nfd7 Be3 Bb7 Nd5 Nc6 Qd2 a5 Bxb5 a4 Nc1 O-O Ne2 a3 b3 Nc5 Ng3 Nd4 Bxd4 exd4 h4 Nxe4 Nxe4 Bxd5 Bd3 f5 gxf6 Bxf6 O-O-O Be5 Kb1 Bf4 Qb4 Bxe4 Bxe4 Be5 Qc4+ Kh8 Bxa8 Qxa8 Qd3 Rc8 Rhf1 Qc6 f4 Bf6 Rfe1 h6 h5 Qg2 Re2 Qg4 Rde1 Qxh5 f5 Qf7 Re6 Qd7 Rxf6 gxf6 Qxd4 Qxf5 Qd2 Kh7 Rh1 Qg6 Re1 Rc7 b4 h5 b5 h4 b6 Rb7 Qd4 Qg3 Rh1 h3 Qe4+,white,outoftime,B92,"Sicilian Defense: Najdorf Variation, Opocensky Variation",0 days 00:05:40.392000,47
bu3Et49A,VasilijeVladacki,dimke1997,2548,2509,2021-07-18 23:54:48.600000+00:00,2021-07-19 00:00:56.550000+00:00,e4 c6 Nc3 d5 d4 dxe4 Nxe4 Bf5 Ng3 Bg6 h4 h6 Nf3 Nd7 h5 Bh7 Bd3 Bxd3 Qxd3 e6 Bd2 Ngf6 O-O-O Be7 Ne4 O-O Nxf6+ Nxf6 g4 Nxg4 Rdg1 f5 Qe2 Rf7 Qxe6 Qc8 Qb3 c5 Ne5 Nxe5 dxe5 c4 Qf3 f4 Rg6 Qf5 Rhg1 Bg5 Qd5 Re8 Bc3 f3+ Kb1 Kh7 Qxc4 a6 a4 Rc8 Qb3 Rfc7 e6 b5 axb5 axb5 Qb4 Rg8 e7 Rc4 Qd6 b4 Bxb4 Qxc2+ Ka2 Ra8+ Ba3 Rca4 Rxg7+ Kxg7 e8=Q Rxa3+ Qxa3 Qc4+ Kb1 Rxe8 Qc3+ Qxc3 bxc3,white,outoftime,B19,"Caro-Kann Defense: Classical Variation, Lobron System",0 days 00:06:07.950000,43
NmGs9KSv,TheChessPrince,dimke1997,2425,2503,2021-07-18 15:55:51.970000+00:00,2021-07-18 16:01:11.525000+00:00,c4 Nf6 Nf3 g6 Nc3 Bg7 e4 d6 d4 O-O Be2 e5 d5 a5 O-O Na6 Ne1 Nc5 Qc2 Bd7 Be3 b6 f3 Ne8 Nd3 f5 exf5 gxf5 f4 e4 Ne1 Nf6 h3 h5 Qd2 Qe8 Nc2 Qg6 Nd4 Rae8 Kh1 Bh6 g3 Kh8 Rg1 Rg8 b3 Nd3 Bxd3 exd3 Qxd3 Ne4 Nde2 h4 Bd4+ Kh7 gxh4 Qh5 Kh2 Qxh4 Rxg8 Rxg8 Rg1 Bxf4+ Nxf4 Qxf4+ Kh1 Ng3+ Kg2 Nf1+,black,resign,E92,"King's Indian Defense: Petrosian Variation, Stein Defense",0 days 00:05:19.555000,35
oeRVtaRi,dimke1997,TheChessPrince,2504,2423,2021-07-18 15:53:13.973000+00:00,2021-07-18 15:55:48.309000+00:00,e4 c5 Nf3 d6 d4 cxd4 Nxd4 Nf6 Nc3 a6 Be2 e6 g4 d5 e5 Nfd7 f4 Nc6 Be3 Bc5 Na4 Qa5+ c3 Nxd4 Bxd4 Bxd4 Qxd4 b5 Nc5 Qb6 Nxd7 Qxd4 cxd4 Bxd7 Kd2 Rc8 Rhc1 Ke7 a4 bxa4 Bxa6 Rxc1 Rxc1 Rb8 Rc2 Kd8 Bd3 h6 f5 Rb4 Ke3 Rb3 Kd2 Rb4 Ke3 Rb3 Kd2 Rb4,draw,draw,B84,"Sicilian Defense: Scheveningen Variation, Classical Variation",0 days 00:02:34.336000,29
woOH65B6,TheChessPrince,dimke1997,2428,2498,2021-07-18 15:47:05.690000+00:00,2021-07-18 15:53:03.339000+00:00,d4 Nf6 c4 g6 Nc3 Bg7 e4 d6 Nf3 O-O Be2 e5 d5 a5 O-O Na6 Qc2 Nh5 Ne1 Nf4 Bxf4 exf4 Nd3 g5 h3 b6 Bg4 Nc5 f3 Bd4+ Kh2 Bxg4 fxg4 Nxd3 Qxd3 Qf6 Nb5 Bxb2 Rab1 Rac8 Na7 Rce8 Nb5 Re7 Rfe1 Rfe8 Kh1 Be5 a4 Kg7 Re2 h5 gxh5 Rh8 Qf3 Qh6 Kg1 Qxh5 Qxh5 Rxh5 Kf2 Rh8 Kf3 Rhe8 Rbe1 Kg6 Rd1 Bh8 Na7 f5 exf5+ Kxf5 Rde1 Rxe2 Rxe2 Rxe2 Kxe2 Ke4 Nb5 Be5 Nxc7 Kd4 Na8 Kxc4 Nxb6+ Kc5 Nd7+ Kxd5 Kd3 Bd4 Nf8 Bg7 Nh7 Bh6 Nf6+ Ke6 Ng4 Bg7 Nf2 d5 Ng4 Kd6 Nf2 Kc5,black,outoftime,E92,"King's Indian Defense: Petrosian Variation, Stein Defense",0 days 00:05:57.649000,52
ZsW5vFvy,dimke1997,TheChessPrince,2491,2433,2021-07-18 15:40:58.599000+00:00,2021-07-18 15:46:58.866000+00:00,d4 d5 c4 c6 Nc3 Nf6 e3 Nbd7 Nf3 e6 Bd3 a6 O-O dxc4 Bxc4 b5 Bb3 c5 e4 Bb7 e5 Ne4 d5 Nxc3 bxc3 c4 dxe6 fxe6 Bc2 Be7 Ng5 Bxg5 Qh5+ g6 Bxg6+ hxg6 Qxg6+ Kf8 Bxg5 Nxe5 Bh6+ Ke7 Qg7+ Kd6 Bf4 Rh5 Rad1+ Bd5 Rfe1 Qh8 Qxh8 Raxh8 Rxe5 Rxe5 Re1 Kc6 Bxe5 Rg8 g3 Bf3 Re3 Bg4 Kg2 Rd8 h3 Bf5 g4 Bg6 h4 Rd3 h5 Rxe3 fxe3 Be4+ Kg3 Kd5 Kf4 a5 g5 b4 g6 b3 axb3 cxb3 c4+ Kxc4 Kxe4,white,resign,D46,Semi-Slav Defense: Main Line,0 days 00:06:00.267000,43
gj5a3BoN,mkid,dimke1997,2391,2485,2021-07-18 10:17:22.058000+00:00,2021-07-18 10:23:00.491000+00:00,Nf3 Nf6 d4 g6 Bg5 Bg7 Nbd2 d6 e4 O-O Bd3 h6 Bh4 c5 dxc5 dxc5 O-O Nc6 h3 Nh5 Rb1 Qc7 Re1 e5 a3 Be6 Qe2 Nf4 Qe3 Nd4 Bg3 Rad8 Nxd4 cxd4 Qf3 a6 Bxf4 exf4 Rbd1 b5 b3 Rc8 Qe2 Rfe8 e5 Bd5 Nf3 f6 Bxg6 Re7 Nxd4 fxe5 Nf5 Re6 Nxg7 Rxg6 Nf5 Bxg2 Kh2 e4 Qh5 f3+ Ng3 Qg7 Rxe4 Rf8 Rde1 Rxg3 fxg3 f2,black,outoftime,A48,Torre Attack: Fianchetto Defense,0 days 00:05:38.433000,35
dv9I155O,dimke1997,Sir_Lancelot1988,2485,2505,2021-07-15 23:52:51.791000+00:00,2021-07-15 23:59:00.189000+00:00,d4 Nf6 c4 e6 Nc3 Bb4 e3 c5 Ne2 O-O a3 Bxc3+ Nxc3 b6 d5 e5 Bd3 d6 O-O Ne8 f4 Nd7 Qc2 g6 f5 Ng7 e4 Nh5 g4 Nf4 Bxf4 exf4 Rxf4 Qg5 Raf1 Ne5 Be2 Bd7 Kg2 Rae8 Kg3 h5 h4 Qh6 g5 Qh8 f6 Rb8 Nd1 b5 Ne3 Rb6 cxb5 Bxb5 Bxb5 Rxb5 R4f2 Rfb8 Nc4 Nxc4 Qxc4 Rb3+ Rf3 Rxb2 e5 dxe5 d6 e4 Re3 Rd2 Rxe4 Rxd6 Re7 Rf8 Rfe1 Rxf6 gxf6 Qxf6 Re8 Qd6+ Qf4 Qd3+ R1e3 Qd1 Rxf8+ Kxf8 Qb8+ Kg7 Qe5+ Kh7 Qf4 Qg1+ Kf3 Qf1+ Ke4 Qc4+ Kf3 Qf1+ Kg3 Qg1+ Kf3 Qf1+,draw,draw,E42,"Nimzo-Indian Defense: Hübner Variation, Rubinstein Variation",0 days 00:06:08.398000,51
YgX0u6DA,aliovchess,dimke1997,2571,2485,2021-07-14 21:37:39.258000+00:00,2021-07-14 21:42:51.183000+00:00,d4 Nf6 c4 g6 g3 Bg7 Bg2 d6 Nf3 O-O O-O c6 Nc3 Qb6 b3 e5 Ba3 Rd8 e3 Qa5 Qc1 exd4 exd4 Bg4 h3 Bxf3 Bxf3 Qc7 Re1 Nbd7 Bb2 Re8 Qf4 a6 g4 h6 h4 Nf8 d5 cxd5 cxd5 N6d7 Rxe8 Rxe8 Rc1 Qb8 Na4 Ne5 Be2 b5 Nc3 Nfd7 Ne4 Qb6 g5 hxg5 hxg5 Nc5 Nf6+ Kf8 Rxc5 Qd8 Rc6 Nxc6 dxc6 d5 c7 Qe7 Bf3 Qe1+ Kg2 Qe6 Ba3+ Re7 Bxe7+ Kxe7 Qb4+ Qd6 c8=Q Qxb4 Qd7+ Kf8 Qe8#,white,mate,E61,"King's Indian Defense: Fianchetto Variation, Benjamin Defense",0 days 00:05:11.925000,41
bcNUrrdB,dimke1997,The3Streets,2493,2476,2021-07-14 18:23:09.407000+00:00,2021-07-14 18:26:25.487000+00:00,e4 c6 d4 d5 e5 Bf5 h4 h6 g4 Be4 f3 Bh7 e6 fxe6 Bd3 Qd6 Kf2 Nf6 Ne2 e5 Bxh7 Nxh7 dxe5 Qxe5 Bf4 Qxb2 Nbc3 Nd7 Rb1 Qa3 Rxb7 e5 Bg3 Bc5+ Kg2 Qa6 Rxd7 Kxd7 Nxd5 cxd5 Qxd5+ Bd6 Rd1 Qxe2+ Kh3 Ng5+,black,resign,B12,"Caro-Kann Defense: Advance Variation, Tal Variation",0 days 00:03:16.080000,23
N9QAQbKF,dimke1997,SpencerCreek,2501,2544,2021-07-14 12:58:59.777000+00:00,2021-07-14 13:05:16.017000+00:00,d4 Nf6 Nf3 Nc6 c4 e5 dxe5 Ng4 Bf4 Bb4+ Nbd2 d6 exd6 Bxd6 Bxd6 Qxd6 e3 Bf5 Be2 O-O-O h3 Nge5 O-O Nxf3+ Nxf3 Qg6 Nd4 Bxh3 Bf3 Ne5 Kh2 c5 gxh3 cxd4 exd4 Rxd4 Qe2 Qf5 Bg2 Rhd8 Rad1 Qf4+ Kh1 Kb8 Rxd4 Rxd4 Rd1 a6 b4 g6 a3 h5 c5 Ka7 Re1 Nd3 Qe7 Nxf2+ Kg1 Nxh3+ Bxh3 Qg3+ Kf1 Qxh3+ Ke2 Qd3+ Kf2 Rf4+ Kg2 Qf3+ Kh2 Qf2+ Kh1 Rh4+ Qxh4 Qxh4+ Kg2 Qxe1 Kf3 Qd2 Ke4 Qc3 Kd5 Qxa3 Kd6 Qxb4 Ke7 Qxc5+ Kf6 a5 Kg7 Qd4+ Kh7 g5 Kh6 f5 Kh7 g4 Kg8 f4 Kh7 h4 Kh6 g3 Kh7 f3 Kg8 Qd5+ Kh7 Qd6 Kg7 f2 Kf7 g2 Kg7 h3 Kg8 h2 Kh8 f1=Q,black,outoftime,A46,Indian Defense: Knights Variation,0 days 00:06:16.240000,60
Wqbsimmj,dimke1997,Bugzilla,2506,2683,2021-07-13 22:33:24.954000+00:00,2021-07-13 22:39:46.562000+00:00,d4 Nf6 Nf3 e6 c4 d5 Nc3 a6 cxd5 exd5 Bf4 Bd6 Bxd6 Qxd6 e3 Bf5 Qb3 Ra7 Be2 Nbd7 O-O O-O Rfd1 c6 Bd3 Bxd3 Rxd3 c5 Qa3 Raa8 Rad1 Rad8 dxc5 Nxc5 Rd4 Ne6 Qxd6 Rxd6 R4d2 Rfd8 Kf1 R6d7 Ne5 Rd6 Nc4 R6d7 Nb6 Rd6 Nbxd5 Kf8 Ke2 Ng4 h3 Ne5 b3 Nc5 e4 Nc6 Ke3 f6 f3 Kf7 Nf4 Rxd2 Rxd2 Rc8 Nfd5 h5 Nb6 Re8 Nd7 Ne6 Nb6 Nc5 Nbd5 h4 Nf4 g5 Nfd5 Ne5 Ne2 Ne6 Nd4 Ng7 Kf2 Rc8 Rc2 Rxc2+ Nxc2 Ne6 Ke3 Ng6 Kf2 Ngf4 Nce3 Nc5 Nxf4 gxf4 Nd5 Nd3+ Ke2 Nc1+ Kd2 Nxa2 Kc2 a5 Nxf4 Nb4+ Kc3 Ke7 Kc4 Kd6 Kb5 Ke5 Nd5 Nc2 Kxa5 Nd4 Kb6 Nxb3 Kxb7 Nd4 Kb6 f5 Nc3 fxe4 Nxe4 Nf5 Kc5 Kf4 Kc4 Ne3+ Kd3 Nxg2 Ke2 Ne3,black,outoftime,D37,Queen's Gambit Declined: Three Knights Variation,0 days 00:06:21.608000,68
W7TUUV1B,Bugzilla,dimke1997,2680,2510,2021-07-13 22:29:20.719000+00:00,2021-07-13 22:33:20.655000+00:00,d4 Nf6 Nf3 g6 Nbd2 Bg7 e4 d6 Bb5+ c6 Bd3 O-O O-O Nbd7 a4 a5 Re1 e5 dxe5 dxe5 Nc4 Qc7 b3 Re8 Ba3 Bf8 Bxf8 Nxf8 Qd2 Bg4 Qg5 Bxf3 Qxf6 Bg4 Qd6 Qxd6 Nxd6 Re7 Nc4 f6 Nb6 Rd8 f3 Be6 Rad1 Nd7 Nc4 Bxc4 Bxc4+ Kf8 Rd6 Rde8 Red1 Nb6 Rxf6+ Kg7 Rfd6 Nxc4 bxc4 Kf7 c5 Re6 Kf2 R8e7 Ke3 h5 h4 Rf6 Rxf6+ Kxf6 Rd6+ Kf7 g3 Kg7 f4,white,resign,A48,East Indian Defense,0 days 00:03:59.936000,37
MPXG5Z8L,Yio05,dimke1997,2534,2519,2021-07-13 16:14:57.207000+00:00,2021-07-13 16:20:58.165000+00:00,Nf3 Nf6 c4 g6 g3 Bg7 Bg2 O-O O-O d6 Nc3 c6 d3 a6 Rb1 d5 b3 d4 Na4 Nfd7 c5 Nf6 Nb6 Ra7 Bb2 e5 Nxe5 Nfd7 Nexd7 Nxd7 Nxc8 Qxc8 Qc2 Re8 Rfe1 Ra8 Qc4 Ne5 Qa4 Qd7 Bxd4 Nf3+ Bxf3 Bxd4 Rbc1 Rad8 Kg2 f5 Qc4+ Kh8 b4 f4 a4 g5 Be4 Rf8 e3 Bg7 Rb1 h5 b5 axb5 axb5 Rde8 bxc6 bxc6 Rb6 f3+ Kh1 Qh3 Rg1 h4 Qc1 Be5 Qf1 Qe6 g4 Bc7 Rxc6 Qe5 Qa1 Qxa1 Rxa1 Bf4 exf4,white,resign,A15,"English Opening: Anglo-Indian Defense, King's Indian Formation",0 days 00:06:00.958000,42
n88twTBv,danikoshvili,dimke1997,2603,2526,2021-07-12 18:38:44.887000+00:00,2021-07-12 18:40:30.196000+00:00,e4 c6 Nf3 d5 Nc3 Bg4 h3 Bxf3 Qxf3 Nf6 d4 dxe4 Nxe4 Qxd4 Bd3 Nxe4 Bxe4 e6 Be3 Qf6 Qg3 Qd8 O-O Nd7 Rad1 Qb8 Bf4 e5 Rxd7 Kxd7 Bxe5 Bd6 Rd1,white,resign,B11,"Caro-Kann Defense: Two Knights Attack, Mindeno Variation, Exchange Line",0 days 00:01:45.309000,16
5yLkJh5B,dimke1997,mnktal,2521,2357,2021-07-12 18:32:05.170000+00:00,2021-07-12 18:38:34.120000+00:00,d4 Nf6 Nf3 g6 c4 Bg7 g3 d6 Bg2 O-O O-O Nc6 Nc3 Rb8 Qd3 a6 d5 Nb4 Qd2 a5 b3 Na6 Bb2 Nc5 Qc2 Bf5 Qd1 Qd7 Re1 Bh3 Bh1 h5 Nd4 h4 e4 hxg3 hxg3 Ng4 Nf3 f5 Ng5 fxe4 Nxh3 Nd3 Qc2 Ngxf2 Nxf2 Rxf2 Re2 Nxb2 Rxf2 Nd3 Rg2 Rf8 g4 Nf4 Rf1 Nh3+ Kh2 Nf4 Nxe4 Be5 Ng3 Qxg4 Rxf4 Rxf4 Rf2 Qh4+ Kg2 Rg4 Rf3 Rxg3+ Rxg3 Qxg3+ Kf1 Qh3+ Bg2 Qg4 Qe2 Qf4+ Qf2 Qc1+ Qe1 Qc2 Qe2 Qc1+ Kf2 Qb2 Bh3 Bd4+ Kf3 Qc3+ Kf4 Qc1+ Kg4 Qg1+ Bg2 Be5 Kg5 Qd4 Qf3 Qd2+ Kxg6 Qc2+ Kh5 Qh7+ Kg5 Qg7+ Kh4 Qh6+ Kg4 Qg6+ Kh3 Qh6+ Kg4 Qg7+ Kh3 Qf6 Kg4 Qxf3+ Bxf3 Bf6 Be4 Be5 Bf5 Kf7 Be6+ Ke8 Bc8 Kd8 Bxb7 c6 Bxc6 Kc7 Kf5 Kb6 Ke4 Kc5 Kf5 Kb4 Ke6 Ka3 Kxe7 Kxa2 Kd7 Kxb3 Ke6 a4 c5 a3 cxd6 a2 d7 a1=Q d8=Q Qd4 Qb8+ Kc2 Qb4 Qc3 Qc5 Qxc5 Kxe5 Kd3 Ke6 Kc4 Kd7 Kc3 Ke6,white,outoftime,E60,"King's Indian Defense: Normal Variation, King's Knight Variation",0 days 00:06:28.950000,84
hfO89A0N,dimke1997,flaggernoob,2527,2649,2021-07-12 00:41:41.877000+00:00,2021-07-12 00:43:08.332000+00:00,d4 d6 Nf3 e5 dxe5 Nc6 Bg5 Qd7 exd6 Bxd6 Nc3 Qg4 h3 Qh5 e4 a6 Qd2 Bg4 Be2 f6 O-O-O Bxf3 Bxf3 Qxg5,black,resign,A04,Zukertort Opening: Vos Gambit,0 days 00:01:26.455000,12
2cMZN6J6,dimke1997,Sharkanto,2518,2489,2021-07-11 00:08:37.925000+00:00,2021-07-11 00:14:51.141000+00:00,e4 c5 Nf3 d6 d4 cxd4 Nxd4 Nf6 Nc3 a6 Be2 e5 Nb3 Be7 g4 h6 Be3 Be6 Bf3 Nc6 Qe2 Rc8 O-O-O Nb4 Kb1 Bc4 Qd2 Qc7 h4 d5 exd5 e4 Nxe4 Nfxd5 Bd4 O-O g5 h5 Bxh5 Rfd8 Rhg1 Nf4 Nf6+ Kf8 Bg4 Be6 Bxe6 Nxe6 c3 Nc6 Qd3 Ncxd4 cxd4 gxf6 Qh7 Ke8 d5 Nf8 Qe4 fxg5 Rge1 Qd6 Nd4 Rd7 Nf5 Qf4 d6 Qxe4+ Rxe4 Ng6 h5 Nf4 Nxe7 Rcd8 Ng6+ Ne6 h6 Rxd6 Rxd6 Rxd6 h7 Kd7 h8=Q Rd1+ Kc2 Nc5 Ne5+ Ke6 Qe8+ Kf5 Qxf7+ Kxe4 Qc4+,white,outoftime,B92,"Sicilian Defense: Najdorf Variation, Opocensky Variation",0 days 00:06:13.216000,46
aaiLI6t7,Sharkanto,dimke1997,2495,2508,2021-07-11 00:05:27.744000+00:00,2021-07-11 00:08:17.420000+00:00,e4 c5 Nf3 Nc6 Bb5 Nf6 Nc3 Qc7 Bxc6 dxc6 d3 Bg4 h3 Bxf3 Qxf3 g6 Bf4 e5 Be3 Nd7 O-O Bg7 Qg3 O-O f4 exf4 Bxf4 Ne5 Nd1 Rfe8 Ne3 Qb6 Rab1 c4 Rfd1 cxd3 cxd3 Rad8 Kh1 Rxd3 Rxd3 Nxd3 Nc4,black,resign,B30,Sicilian Defense: Nyezhmetdinov-Rossolimo Attack,0 days 00:02:49.676000,21
smPDo9i6,Neftegor,dimke1997,2598,2516,2021-07-11 00:00:13.161000+00:00,2021-07-11 00:04:54.419000+00:00,d4 Nf6 c4 g6 Nc3 Bg7 e4 d6 Nf3 O-O Be2 e5 O-O Nc6 d5 Ne7 Bg5 Nh5 Ne1 Nf4 Nd3 Nxe2+ Qxe2 f6 Bd2 f5 f4 fxe4 Nxe4 exf4 Bxf4 Nf5 Bg5 Qe8 Rae1 Bd7 Qd2 Qc8 g4 Nd4 Nf6+ Kh8 h3 h6 Nf4 Rxf6 Bxf6 Bxf6 Nxg6+ Kg7 Rxf6 Kxf6 Qxd4+ Kxg6 Re7 Qh8 Qd3+ Kg5 Rxd7 Rf8 Kg2 Qf6 Qe3+ Kh4 Qg3+ Kg5 h4+ Kg6 Qd3+,white,resign,E97,"King's Indian Defense: Orthodox Variation, Aronin-Taimanov Defense",0 days 00:04:41.258000,34
Yewj9sJP,dimke1997,duboka,2508,2392,2021-07-10 20:13:30.714000+00:00,2021-07-10 20:15:59.289000+00:00,e4 c6 d4 d5 Nd2 dxe4 Nxe4 Nf6 Nxf6+ exf6 c3 Bd6 Bd3 O-O Ne2 Re8 Qc2 h5 Be3 Nd7 O-O-O Nf8 Kb1 Be6 h3 b5 Nf4 Bxf4 Bxf4 a5 g4 h4 Rdg1 a4 a3 Qd5 g5 f5 Re1 Ng6 Bd2 Rad8 f4 Qf3 Bxf5 Bxf5 Qxf5 Rxe1+ Rxe1 Rxd4 cxd4,white,resign,B15,Caro-Kann Defense: Tartakower Variation,0 days 00:02:28.575000,25
cRCAPyez,kucks1,dimke1997,2483,2498,2021-07-10 20:07:35.282000+00:00,2021-07-10 20:13:18.280000+00:00,e4 c6 d4 d5 e5 Bf5 Nf3 e6 Be2 Bg6 Nbd2 Ne7 O-O Nf5 Nb3 Nd7 Bd2 Be7 g4 Nh4 Nxh4 Bxh4 f4 f5 g5 h6 Bh5 Kf7 Bxg6+ Kxg6 gxh6 Rxh6 Qf3 Kh7 Be1 Nf8 Bxh4 Qxh4 Rf2 Re8 Rg2 Re7 Rf1 Rf7 Nc5 Qh5 Nd3 Qxf3 Rxf3 Rh4 Rgg3 b6 Rh3 Rxh3 Rxh3+ Kg8 a4 Rc7 Nf2 c5 Rc3 Kf7 b4 Nd7 dxc5 bxc5 Nd3 c4 Ne1 a6 b5 axb5 axb5 Rb7 Ra3 Rxb5 Ra7 Ke8 Nf3 c3 Nd4 Rb6 Ra8+ Ke7 Rg8 Kf7 Rd8 Nc5 Rc8 Ne4 Rc7+ Kg6 Re7 Rb1+ Kg2 Rd1 Nxe6 Rd2+ Kf3 Rxc2 Rxg7+ Kh6 Rc7 Rd2 Ng5 Nxg5+ fxg5+ Kxg5 Rxc3 f4 h4+ Kf5 h5 Rh2 e6 Rh3+ Kg2 Rxc3 h6 Rc7,black,resign,B12,"Caro-Kann Defense: Advance Variation, Short Variation",0 days 00:05:42.998000,60
mEx0CSIQ,dimke1997,kucks1,2498,2483,2021-07-10 20:03:38.464000+00:00,2021-07-10 20:07:31.718000+00:00,e4 e5 Nf3 Nc6 Bb5 Nf6 O-O Nxe4 Re1 Nd6 Ba4 e4 Nc3 Be7 Nxe4 Nxe4 Rxe4 O-O d4 d5 Re1 Bd6 h3 Ne7 c3 c6 Bc2 Bf5 Ne5 Bxc2 Qxc2 Ng6 Bd2 Re8 f4 Qh4 Re2 f6 Nxg6 hxg6 Rae1 Rxe2 Rxe2 Kf7 Qc1 Re8 Rxe8 Kxe8 Qf1 Kf7 Qf3 Qh5 Kf2 Qxf3+ Kxf3 Ke6 g4 b5 Ke3 a5 Kd3 a4 a3 Be7 Be3 Bd6,draw,draw,C67,"Ruy Lopez: Berlin Defense, Rio Gambit Accepted",0 days 00:03:53.254000,33
pCsDuOxY,kawhi2,dimke1997,2467,2487,2021-07-10 20:00:44.453000+00:00,2021-07-10 20:03:28.946000+00:00,g3 g6 Bg2 Bg7 d4 Nf6 e4 d6 Nc3 O-O Nge2 e5 h3 Bd7 Be3 exd4 Bxd4 Nc6 Be3 Re8 O-O a6 f4 Na5 g4 Nc4 Bc1 c6 Ng3 Qb6+ Kh2 Ne3 Bxe3 Qxe3 Qxd6 Rad8 Qd3 Qb6 Na4 Qa5 Qa3 Bf8 Qc3 Qxa4 Qxf6 Bg7 Qh4 Qxc2 e5 Be6 Rae1 Rd2 Rg1 Bd5 Ne4 Bxe4,black,resign,A00,Hungarian Opening: Symmetrical Variation,0 days 00:02:44.493000,28
BWR2IdgJ,Gabriel_Young,dimke1997,2438,2476,2021-07-10 19:58:00.234000+00:00,2021-07-10 20:00:35.925000+00:00,e4 c5 Nf3 Nc6 c4 e5 Nc3 g6 d3 Bg7 g3 Nge7 Bg2 O-O O-O d6 Nd5 h6 Ne1 Be6 Nc2 f5 f4 Qd7 Be3 Rae8 Rb1 Nd4 Nxd4 cxd4 Bd2 fxe4 Bxe4 Nxd5 cxd5 Bh3 Bg2 Bxg2 Kxg2 e4 dxe4 Rxe4 Rf2 Qf5 Qb3 Rfe8 Rbf1 Re2 Qf3 d3 Bc3 Bxc3 bxc3 R8e3 g4 Rxf3 gxf5 Rfxf2+ Rxf2 d2 Rxe2 d1=Q Re6 Qxd5+,black,resign,B30,Sicilian Defense: Old Sicilian,0 days 00:02:35.691000,32
iilm7NGy,dimke1997,luchok123,2487,2459,2021-06-18 09:13:00.310000+00:00,2021-06-18 09:13:33.665000+00:00,e4 c5 Nf3 e6 d4 cxd4 Nxd4 Qb6 Nc3 Bc5 Na4 Qa5+ c3 Bxd4 Qxd4 Nf6 e5 Nc6,black,resign,B40,Sicilian Defense: Kveinis Variation,0 days 00:00:33.355000,9
ukitnH9w,UsaninMikhail,dimke1997,2575,2496,2021-06-15 12:36:07.204000+00:00,2021-06-15 12:42:01.925000+00:00,c4 g6 Nc3 Bg7 d4 Nf6 e4 d6 Nf3 O-O Be2 e5 O-O Nc6 d5 Ne7 b4 a5 Ba3 axb4 Bxb4 b6 a4 Ne8 Nb5 f5 Nd2 Bh6 a5 bxa5 Rxa5 Rb8 c5 Bxd2 Qxd2 fxe4 cxd6 cxd6 Ra7 Nf5 g4 Nh4 Qh6 Rb7 Rxb7 Bxb7 Nxd6 Nxd6 Bxd6 Rf7 Bxe5 Nf3+ Bxf3 exf3 d6 Bc8 Rc1 Bxg4 h3 Bd7 Rc7 Qb8 Kh2 Qb6 Qh4 Qb5 Qd8+ Rf8 Qe7 Rf7 Qg5 Qf1 Qg3 Bxh3 Rxf7 Kxf7 Qxf3+ Bf5 Qd5+ Ke8 Qc6+ Kf7 Qf3 Ke6 Bg3 Qc4 Qe3+ Kd7 Qe7+ Kc6 Qc7+ Kd5 Qb7+ Kd4 d7 Kd3 d8=Q+,white,outoftime,E97,"King's Indian Defense: Orthodox Variation, Bayonet Attack",0 days 00:05:54.721000,48
gZ8VTobu,dimke1997,UsaninMikhail,2505,2570,2021-06-15 12:34:35.507000+00:00,2021-06-15 12:36:01.825000+00:00,e4 e5 Nf3 Nc6 Bb5 a6 Ba4 Nf6 O-O b5 Bb3 Bb7 c3 Bc5 d4 exd4 cxd4 Bb6 e5 Ng4 Bxf7+ Kxf7 Ng5+ Ke8 Qxg4 Nxd4 Nc3 Qe7 Bf4 Ne6 Nxe6 Qxe6 Qxg7 Rg8 Qxh7 Rxg2+,black,resign,C78,"Ruy Lopez: Morphy Defense, Arkhangelsk Variation",0 days 00:01:26.318000,18
pQv2OP0s,UsaninMikhail,dimke1997,2578,2490,2021-06-15 12:31:05.365000+00:00,2021-06-15 12:34:26.964000+00:00,c4 g6 Nc3 Bg7 d4 Nf6 e4 d6 Nf3 O-O Be2 e5 O-O exd4 Nxd4 Re8 f3 Nc6 Be3 Nh5 Re1 Be5 Qd2 Qh4 f4 Nxf4 g3 Nxe2+ Ncxe2 Qd8 Rf1 Bg4 Nxc6 bxc6 Bg5 Qd7 Nd4 c5 Nf3 Bg7 Rae1 Re6 Qf4 Bxf3 Rxf3 Rae8 b3 f6 Bh6 g5 Bxg5 fxg5 Qxg5 c6 Ref1 Rxe4 Rf7 Qxf7 Rxf7 Kxf7 Qf5+ Kg8 Qd7 Re2 Qxc6 Bd4+ Kf1 Rf2+ Kg1 Re1#,black,mate,E94,King's Indian Defense: Orthodox Variation,0 days 00:03:21.599000,35
oqyhzfkX,dimke1997,industrial_strength,2504,2469,2021-06-15 08:33:08.060000+00:00,2021-06-15 08:36:17.317000+00:00,e4 c5 Nf3 e6 d4 cxd4 Nxd4 Nc6 Nc3 a6 Be3 Qc7 Bd3 Nf6 f4 d6 Qf3 Bd7 O-O-O Nxd4 Bxd4 Bc6 g4 O-O-O g5 Nd7 Kb1 Nc5 h4 h6 f5 hxg5 hxg5 Rxh1 Rxh1 Nxd3 cxd3 d5 e5 Kb8 Qe3 exf5 Bb6 Qd7 Bxd8 d4 Qf4 Bxh1,black,resign,B46,Sicilian Defense: Taimanov Variation,0 days 00:03:09.257000,24
pdAxmZMp,kintoho,dimke1997,2578,2514,2021-06-12 13:42:54.197000+00:00,2021-06-12 13:48:19.029000+00:00,e4 c5 c3 Nf6 e5 Nd5 d4 cxd4 cxd4 d6 Nf3 Nc6 Bc4 Nb6 Bb5 Bd7 exd6 e6 Bg5 Qb8 Nc3 Bxd6 O-O O-O Re1 h6 Bh4 Ne7 Bd3 Bc6 Ne5 Bd5 Bc2 Nf5 Qd3 Bxe5 Rxe5 g6 Bf6 Qd6 Qh3 Nd7 Rxf5 exf5 Nxd5 Nxf6 Nxf6+ Qxf6 Qxh6 Rad8 Bb3 Rxd4 h3 Rfd8 Re1 Rd2 Re3 R2d4 Rg3 R4d6 h4 Qg7 Qg5 Re8 h5 Re1+ Kh2 Kf8 h6 Qd4 Rc3 Rd8 h7 Kg7 Rc7 Qd6+ Qg3 f4 Rxf7+ Kh8 Qc3+ Qd4 Rf8+ Kxh7 Qh3+ Kg7 Qh8#,white,mate,B22,"Sicilian Defense: Alapin Variation, Smith-Morra Declined",0 days 00:05:24.832000,43
Tbd7EwH5,dimke1997,zigbert67,2506,2348,2021-06-06 11:40:13.653000+00:00,2021-06-06 11:46:13.180000+00:00,d4 Nf6 Nf3 e6 c4 Bb4+ Nbd2 O-O a3 Bxd2+ Qxd2 d6 e3 b6 b4 Bb7 Be2 Nbd7 Bb2 Ne4 Qc2 f5 O-O Qf6 d5 e5 Ne1 Qg6 f3 Ng5 Kh1 Nf6 Nd3 Nh5 f4 exf4 Nxf4 Nxf4 exf4 Ne4 Bd3 Rae8 Rae1 Re7 Re2 Rfe8 Rfe1 b5 Bxe4 fxe4 cxb5 Bxd5 Re3 Qf5 Rf1 Re6 g4 Qxg4 Rg1 Qxf4 Bxg7 Rg6 Bd4 Rxg1+ Kxg1 Kf7 Qf2 Rg8+ Kf1 Bc4+ Ke1 Qxf2+ Kxf2 Bd3 Rh3 Kg6 Ke3 Rf8 Rg3+ Kf5 Rg7 Rf7 Rxf7+,white,resign,E11,Bogo-Indian Defense: Grünfeld Variation,0 days 00:05:59.527000,41
5aFdSRPG,lubitel1972,dimke1997,2369,2498,2021-05-20 19:02:59.087000+00:00,2021-05-20 19:08:40.239000+00:00,d4 Nf6 c4 g6 Nc3 Bg7 e4 d6 Nf3 O-O Be2 e5 d5 a5 Be3 Ng4 Bg5 f6 Bh4 h5 Nd2 Nh6 f3 Na6 a3 Bd7 O-O g5 Bf2 f5 exf5 Nxf5 Nde4 Qe7 Rb1 Bh6 b4 axb4 axb4 g4 fxg4 Ne3 Qd2 Nxg4 Qd3 Nxf2 Rxf2 Rxf2 Nxf2 Rf8 Nce4 h4 h3 Qg7 Bg4 Nb8 Bxd7 Nxd7 Ng4 Bf4 c5 Qg6 c6 bxc6 dxc6 Nb6 Ra1 d5 Nc5 Qxd3 Nxd3 e4 Nc5 Bd6 Ne6 Ra8 Rxa8+ Nxa8 b5 Kf7 Nd4 Bc5,black,resign,E92,"King's Indian Defense: Petrosian Variation, Stein Defense",0 days 00:05:41.152000,41
Gy6f8v3k,dimke1997,Hayk_Yeritsyann,2510,2512,2021-05-17 16:22:17.659000+00:00,2021-05-17 16:27:54.893000+00:00,d4 Nf6 c4 c5 d5 b5 cxb5 a6 bxa6 g6 Nc3 Bg7 e4 O-O e5 Ne8 Nf3 Qa5 Be2 Bxa6 O-O Nc7 Re1 d6 Bf4 Rd8 exd6 exd6 Bxa6 Nbxa6 Nd2 Nb4 Nc4 Qa6 Nxd6 Rxd6 Bxd6 Qxd6 a3 Nbxd5 Ne4 Qb6 Rc1 Bd4 Qf3 Kg7 Red1 Re8 h3 h6 b4 cxb4 Nd6 Qxd6 Rxd4 bxa3 g3 Qe5 Ra4 Qb2 Qxa3 Qxa3 Rxa3 Ne6 Rd3 Nf6 Re1 g5 Ra3 Rd8 Ra7 Kg6 g4 Rd3 Kh2 Nd5 Re5 Nef4 Ra6+ Kg7 Ra7 Rxh3+ Kg1 Rd3 Rf5 Nf6 Ra6 N4d5 Rd6 Rd4 Rfxf6 Rxg4+ Kh2 Nxf6 Kh3 Rf4,black,outoftime,A58,Benko Gambit Accepted: Fully Accepted Variation,0 days 00:05:37.234000,48
VuM8tEiu,cesarsuaorusia,dimke1997,2449,2500,2021-05-04 00:30:09.077000+00:00,2021-05-04 00:36:21.561000+00:00,d4 Nf6 Nf3 g6 g3 Bg7 Bg2 O-O h4 h5 Nc3 d5 Bg5 c6 Ne5 Bf5 Qd2 Nbd7 Nxd7 Qxd7 O-O-O Ne4 Nxe4 dxe4 Bh6 Qd5 Kb1 Be6 b3 a5 Bxg7 Kxg7 c4 Qf5 Bh3 e3+ Bxf5 Bxf5+ Qc2 Bxc2+ Kxc2 exf2 Rhf1 a4 Rxf2 axb3+ axb3 Ra2+ Kc3 Rd8 Rdf1 f6 e4 Rxf2 Rxf2 e6 b4 b5 Ra2 g5 Ra7+ Kg6 Rc7 Ra8 Rxc6 Ra3+ Kb2 Rxg3 cxb5 gxh4 b6 h3 b7 h2 b8=Q Rg2+ Kb3 h1=Q Qg8+ Kh6 Qf8+ Kg6 Qg8+ Kh6 Qf8+ Kg5 Qg7+ Kh4 Qxf6+ Kh3 Qxe6+ Kh2 Qe5+ Rg3+ Kc4 Qc1+ Kb5 Qf1+ Kb6 Qf2 Qxh5+ Rh3,black,outoftime,A49,Indian Defense: Przepiorka Variation,0 days 00:06:12.484000,51
1iqTNZfT,dimke1997,hammdan_cadas,2496,2418,2021-02-01 01:54:48.583000+00:00,2021-02-01 01:59:25.997000+00:00,d4 e6 c4 Ne7 Nc3 g6 e4 Bg7 h4 O-O h5 d6 Be3 Qd7 Qd2 Nbc6 Nf3 Rd8 Bh6 Bh8 O-O-O a6 d5 Ne5 Nxe5 dxe5 Bg5 f6 Be3 exd5 cxd5 Qe8 Bc4 Rd6 Bc5 Bd7 Bb3 Bg7 Kb1 b5 hxg6 hxg6 f4 Nc8 fxe5 Qxe5 Bd4 Qe7 Rdf1 b4 Ne2 Qxe4+ Bc2 Qg4 Rf4 Qg5 Be3 Qxd5 Bb3 Be6 Bxd5 Rxd5 Rd4 Bf5+ Ka1 Rxd4 Nxd4 Be4 Bh6 Nd6 Bxg7 Kxg7 Qh6+ Kf7 Qh7+,white,resign,A40,Horwitz Defense,0 days 00:04:37.414000,37
WiKXpsy8,Uncrowned_King,dimke1997,2418,2491,2021-02-01 01:49:15.691000+00:00,2021-02-01 01:54:25.926000+00:00,d4 Nf6 Nf3 g6 c4 Bg7 Nc3 d6 e4 O-O Be2 e5 dxe5 dxe5 Qxd8 Rxd8 Bg5 Re8 Nd5 Nxd5 cxd5 c6 Bc4 b5 Bb3 a5 a3 a4 Ba2 c5 O-O-O Bd7 Kb1 c4 Be3 Na6 Rc1 f6 Rhd1 Bf8 Ka1 Bc5 Re1 Bxe3 Rxe3 Nc5 Ne1 Kg7 f3 f5 exf5 gxf5 Nc2 Nd3 Rd1 Kf6 Nb4 Nxb4 axb4 Ra6 Bb1 Rd6 g4 f4 Re4 Bc6 Ree1 Rxd5 Rc1 Rd2 h4 h6 Rf1 Red8 Rce1 a3 g5+ hxg5 hxg5+ Kg7 bxa3 Ra8,black,resign,E92,King's Indian Defense: Exchange Variation,0 days 00:05:10.235000,41
qO6RiBhH,dimke1997,TheRedKing89,2495,2628,2021-02-01 01:38:47.186000+00:00,2021-02-01 01:40:06.940000+00:00,d4 Nf6 Nf3 Ng8 Ng1 Nf6 Nf3 g6 c4 Bg7 g3 O-O Bg2 c5 O-O cxd4 Nxd4 Nc6 Nc3 Qb6 Nb3 d6 h3 Be6 Be3 Qa6 Nb5 Rac8 Na3 Bxc4 Nxc4 Qxc4 Rc1 Qa6 Qd2 Qxa2,black,resign,E60,"King's Indian Defense: Normal Variation, King's Knight Variation",0 days 00:01:19.754000,18
